,name_id,name,created_at,desc,u_id,num_followers,num_following,num_tweets,img,partei,retweet_rate,replie_rate,ts_perday,hashtags,avg_sent,tweet_rate
269,@ulschzi,"Ulrike Schielke-Ziesing,MdB",2012-10-07 20:39:05,Gewähltes Mitglied des Deutschen Bundestages für den Wahlkreis 17 Mecklenburgische-Seenplatte. Für eine Politik zum Wohle der deutschen Bürger.,866924100,1675,406,1470,https://pbs.twimg.com/profile_images/1033826280582639616/yVb-GdPi.jpg,afd,0.2,0.0,2.1389919355463243,"CDU, AfD, AfDimBundestag, maskenaffaere, Maskenskandal, ltwbw21, ltwrlp21, ltwbw2021, ltwrlp, LTWrp, ltw, SPD, AfD, AfDimBundestag, Coronakrise, AfD, AfDimBundestag, Polizei, Linksextremismus, Schwesig, AfD, AfDimBundestag, AfD, AfDimBundestag, Coronakrise, AfD, Coronakrise, AfD, Coronakrise, CDU, CSU, Nuesslein, Loebel, Fischer, Hauptmann, Korruptionsaffaere, GroKo, Aserbaidschan, PCR, AfD, AfDimBundestag, Europa, Islamisme, Islam, Terrorist, SPD, AfD, AfDimBundestag, Korruption, cdu, csu, Laschet, Söder, Hohlmeier, Tandler, AfD, Burkaverbot, Schweiz, AfD, AfDimBundestag, Islamismus, Islam, AfD, AfDimBundestag, AfD, AfDimBundestag, feminist, Verfassungsschutz, AfD, AfDimBundestag, AfD, Verfassungsschutz, ",0.008583333333333321,0.8
270,@KayGottschalk1,Kay Gottschalk MdB,2013-03-21 13:39:27,Geboren am 12.12.1965 in Hamburg  Abitur und danach eine Banklehre. Im Anschluss Doppelstudium BWL und Jura. Danach Managementpositionen.,1286011081,4316,578,1581,https://pbs.twimg.com/profile_images/3451125536/626c346f758340261dd7e3090ca19c66.jpeg,afd,0.75,0.05,1.1145910246213753,"ltwbw21, ltwrlp21, Afd, ltwbw21, ltwrlp21, Afd, Wirecard, GdP, GdP, reisepässe, österreicher, Verfassungsschutz, Wirecard, Untersuchungsausschuss, AfD, Bundestag, VS, Verdachtsfall, AfD, sms, ibizaUA, kanzler, pilnacek, Massaker, Meinungsfreiheit, Medien, Extremisten, AfD, Deutschland, Impfungen, Corona, Wirecard, Wirecard, AfD, Wirecard, GroKo, AfD, ",0.150625,0.19999999999999996
271,@hermiworld,,,,,,,,,afd,,,,,,
272,@AfDProtschka,Stephan Protschka MdB,2013-05-08 08:33:07,"Agrarpolitischer Sprecher der AfD Fraktion, stell. Sprecher der Heimatvertriebenen, Mitglied im Bundesvorstand der AfD, Bezirksvorsitzender Niederbayern",1412287272,5686,1779,3456,https://pbs.twimg.com/profile_images/1266323037248524289/gXZZGztV.jpg,afd,0.05,0.2,1.0022697806216985,"Corona, Spahn, Wieler, Deutschland, Schäuble, maskenaffaere, CDU, CSU, Scheuer, CDU, CSU, Maskengate, CDU, CSU, CDU, Deutschland, Lockdown3, Merkel, Seehofer, AfD, Hessen, lockdown, MerkelMussWeg, Deutschland, Pandemie, Merkel, Parteien, AfD, BMI, Prüffall, Bundestag, ",0.12322916666666665,0.75
273,@ttte94,Gerold Otten,2013-06-20 15:24:36,,1534201208,413,7,61,https://pbs.twimg.com/profile_images/890211686241763328/dU4DuGpf.jpg,afd,0.45,0.1,0.015452737179435214,"Buschmann, FDP, AfD, Attentat, Bundestag, Klimakabinett, Benzin, Diesel, Kohle, Klimastreik, Fridaysforfuture, Groko, EU, vonderLeyen, Bundeswehr, DiversityDay, FlaggefuerVielfalt, Verfassungsschutz, Prüffall, AfD, AfD, Bundestag, Bremen, Magnitz, Nobel, AfD, AfD, Merkel, AfDwaehlen, Bundestagswahl, Merkel, entsorgen, Merkel, entsorgen, AfD, ",-0.07083333333333333,0.44999999999999996
274,@axelgehrke,"Prof. Dr. med. Axel Gehrke, MdB",2013-09-14 05:37:38,"Arzt, Hochschullehrer, #AfD-Bundestagsfraktion, Vorsitzender IFFG Hannover",1862781722,650,136,139,https://pbs.twimg.com/profile_images/737303500384796672/H5zBnnw1.jpg,afd,0.05,0.1,0.021406843612022892,"Corona, multiresistenten, Parlamentarische, Corona, multiresistenten, Parlamentarische, fridaysforfuture, Berlin, Deutschland, Magnitz, Ausgrenzung, gewalt, rechts, ",0.08747222222222222,0.85
275,@MalsackWinkeman,Dr. Birgit Malsack-Winkemann MdB,2014-03-02 11:02:21,"Mitglied des Deutschen Bundestages Obfrau der #AfD-Fraktion im Haushaltsausschuss,   Juristin (Richterin a.D.)",2368711488,1570,1867,462,https://pbs.twimg.com/profile_images/1323933405072003072/lDm6E03u.jpg,afd,0.0,0.0,0.6592927757523583,"AfD, AfD, AfD, AfD, AfD, AfD, AfD, AfD, AfD, AfD, AfD, AfD, AfD, AfD, AfD, AfD, AfD, AfD, AfD, AfD, ",-0.009583333333333336,1.0
276,@TobiasMPeterka,Tobias Matthias Peterka,2014-05-15 10:45:25,"▫ Diplom-Jurist, Wirtschaftsjurist (Univ. Bayreuth) ▫ Mitglied des Bundestages ▫ Rechtsausschuss ▫ Bezirksvorsitzender AfD Oberfranken 🇩🇪",2496104640,1501,461,1207,https://pbs.twimg.com/profile_images/1328685763618332674/-rmNv6TQ.jpg,afd,0.0,0.05,0.5104859817064011,"Bundesregierung, Corona, Hilfsgelder, Betrug, OlafScholz, Täterherkunft, Deutschland, Berichterstattung, Verhüllungsverbot, Volksentscheid, Schweiz, Polizei, Kriminalität, Antifa, Lobbyismus, Skandale, Korruption, Maskenaffäre, CDU, CSU, Löbel, Nüßlein, Union, Amthor, Lobby, Klöckner, Nüßlein, Löbel, CDU, CSU, Maskenskandal, Verfassungsschutz, Verfassungsschutz, AfD, Muezzin, Hessen, Islamisierung, Drogen, Bürger, Corona, Mathematik, rassistisch, US, Oregon, Linksextreme, Antifa, LTWBW, AfD, Staatsbürgerschaft, Einbürgerungen, Deutschland, Wochenstart, Grundrechte, Corona, Covid19, Merkel, Kretschmer, Lauterbach, Kollateralschäden, Lockdown, EVP, Weber, CSU, Impfzwang, Impfplicht, Corona, Covid19, ",-0.043819444444444446,0.95
277,@Huber_AfD,"Johannes Huber, MdB",2014-05-27 09:51:54,"Johannes Huber, @AfDimBundestag-MdB. | Profil im Aufbau. | Folgen Sie bitte auch @AfD & @AfDKompakt. #AfD #Bundestag",2527085323,404,3,17,https://pbs.twimg.com/profile_images/918272780822614016/Rm9ySC2M.jpg,afd,1.0,0.0,0.013602399316769974,"FDP, AfD, AfD, AfD, AfD, Glaser, TagderDeutschenEinheit, TagderDeutschenEinheit, AfD, AfD, Chrupalla, AfD, AfD, AfD, AfD, twitter280, 280Zeichen, AfD, AfD, AfD, ",0.09362745098039216,0.0
278,@Renner_AfD,"Martin E. Renner, MdB",2014-05-30 16:12:59,"Martin E. Renner, @AfDimBundestag-MdB. #Bundestag #AfD #NRW",2535401947,7239,2741,15490,https://pbs.twimg.com/profile_images/857591609134919680/I5R2BlRo.jpg,afd,0.85,0.0,16.227608152166297,"AfD, ltwbw21, AfD, ltwbw21, ltwrlp21, ltwbw2021, ltwrlp, LTWrp, ltw, AfD, Deutschland, ltwbw21, BadenWürttemberg, Gegenöffentlichkeit, AfD, Wahl, AfD, RheinlandPfalz, BadenWürttemberg, ltwrlp21, ltwbw21, Wahlen, ltw, Diskriminierung, SPD, Migranten, Jobs, linke, Gleichberechtigung, Migrationspakt, Pressefreiheit, ltw, ltwbw21, ltwbw2021, ltwrlp21, ltwrlp, AfD, AfDwaehlen, heimat, ltw, ltwrlp21, rlp, afdrlp, watch, kontrolle, Wahlen, ",-0.060416666666666674,0.15000000000000002
279,@M_Reichardt_AfD,"Martin Reichardt, MdB",2014-06-04 10:26:57,"Familienpolitischer Sprecher @AfDimBundestag 
Landesvorsitzender @AfD_LSA |
Landesgruppensprecher LSA https://t.co/6VNXe6N2V2",2545743991,6936,1009,4954,https://pbs.twimg.com/profile_images/927375042387890176/rsmR-NLR.jpg,afd,0.2,0.4,6.529021948296278,"COVID19, lockdown, CDUKorruption, AfDwaehlen, AfDwirkt, RheinlandPfalz, BadenWürttemberg, ltwbw21, ltwrlp21, Corona, SachsenAnhalt, Merkel, Stalinisten, Fukushima, Atomausstieg, Corona, lockdown, MerkelMussWeg, ",-0.012750000000000001,0.3999999999999999
280,@mrosek1958,"Andreas Mrosek, MdB (AfD)",2014-07-11 22:07:33,,2618890032,2434,366,2794,https://pbs.twimg.com/profile_images/1222236814972420096/WG1qnlAS.jpg,afd,0.2,0.35,1.780324319939448,"Amthor, ifg, ",-0.025,0.44999999999999996
281,@BerndBaumannAfD,"Dr. Bernd Baumann, AfD",2015-02-17 21:57:24,"MdB Dr. Bernd #Baumann, Wirtschaftswissenschaftler, #AfD Hamburg, 1. Parlamentarischer Geschäftsführer der @AfDimBundestag| @AfD",3043727333,2373,139,117,https://pbs.twimg.com/profile_images/1207336664835731456/5CQk5dDH.jpg,afd,0.1,0.1,0.3377316062364584,"BerlinerRunde, ZDF, ltwrlp21, ltwbw2021, Landtagswahl2021, AfDwaehlen, AfD, CDU, CSU, AfD, Korruption, CDUKorruption, Aserbaidschan, Bundestag, Bareiß, Staatssekretär, Atomausstieg, Euro, Migration, Corona, AfD, NieMehrCDU, Corona, Lockdown, CDU, cdukorrupt, Lockdown, Migration, Clankriminalität, Niedrigzinspolitik, Verfassungsschutz, AfD, Söder, Kretschmer, Impfpflicht, AfD, AfD, Impfpflicht, AfD, Regierung, Impfstoffe, NieMehrCDU, NiemehrGrüne, AfD, Corona, Migrationshintergrund, Clankriminalität, Bundestag, Altparteien, AfD, Corona, Merkel, lockdownverlaengerung, AfD, CDU, SPD, AfD, AfD, Bundestag, Linke, cdupt21, ",0.010000000000000005,0.8
282,@Nicole_Hoechst,"Nicole Höchst, MdB",2015-03-22 15:50:41,"Facebook: 
https://t.co/x0HwhpY49i 
https://t.co/gROdJE1usC 
Folgen Sie bitte auch @AfDimBundestag @AfD",3105025175,4243,824,9595,https://pbs.twimg.com/profile_images/1316280884526493696/BL1xgNCb.jpg,afd,0.05,0.0,2.146591615806862,"Verhuellungsverbot, Burka, zeitfürpolitikwechsel, zeitfürveränderungen, zeitfürafd, ",0.06999999999999999,0.95
283,@Heiko_Wildberg,Dr. Heiko Wildberg,2015-04-19 17:46:38,"Dr. Heiko Wildberg, @AfDimBundestag-MdB | Profil im Aufbau. | Bitte auch @AfD & @AfDKompakt folgen!",3183992596,328,10,12,https://pbs.twimg.com/profile_images/917456728270229504/xq_NLWQO.jpg,afd,1.0,0.0,0.009584413060615696,"AfD, AfD, AfD, Glaser, TagderDeutschenEinheit, TagderDeutschenEinheit, AfD, AfD, AfD, AfD, AfD, twitter280, 280Zeichen, AfD, AfD, ",0.09097222222222222,0.0
284,@Siegbert_Droese,"Siegbert Dröse, MdB",2015-04-19 19:12:45,"Siegbert Dröse, @AfDimBundestag-MdB | Profil im Aufbau. | Bitte auch @AfD & @AfDKompakt folgen!",3184216371,356,26,13,https://pbs.twimg.com/profile_images/917462078671278080/g11fhzYS.jpg,afd,1.0,0.0,0.010383266268688619,"AfD, Chrupalla, AfD, AfD, AfD, twitter280, 280Zeichen, AfD, AfD, AfD, TagderDeutschenEinheit, AfD, TagderDeutschenEinheit, AfD, Glaser, AfD, AfD, ",0.08397435897435897,0.0
285,@Thomas_Ehrhorn,"Thomas Ehrhorn, MdB",2015-05-08 19:41:04,@AfDimBundestag-MdB der #AfD #Niedersachsen.,3242322815,1153,233,821,https://pbs.twimg.com/profile_images/1047770159975452673/6uEvMR77.jpg,afd,0.75,0.0,0.12952008003791546,"zerogez, GEZ, Böhmermann, Überwachungsstaat, CSU, AfD, Corona, AfD, Bundestag, Liebig34, Vernunft, Verantwortung, Energiewende, ",0.048249999999999994,0.25
286,@PeterFelser,Peter Felser MdB,2015-07-20 18:34:15,"MdB Peter #Felser, Stellvertretender Vorsitzender der @AfDimBundestag-Fraktion, c/o AfD-Kreisverband Oberallgäu-Kempten-Lindau Postfach 10, 87467 Durach",3384789731,1446,335,458,https://pbs.twimg.com/profile_images/1328255175023337472/bNU5lBDD.jpg,afd,0.2,0.0,0.822574005857586,"CDU, Maskenskandal, AfD, AfD, CSU, Nuesslein, Soeder, Maskenskandal, Seehofer, Haldenwang, AfD, Verdachtsfall, Verfassungsschutz, AfD, Demokratie, AfD, Wahljahr, AfD, Verdachtsfall, VS, AfD, Verdachtsfall, Sauter, AfD, Grüne, Hornuf, BaumDesJahres, AfD, Umweltschutz, AfD, Abwahljahr2021, Bayern, Verboten, Corona, AfD, Corona, AfD, Lockdown, Einzelhandel, Bundestag, Corona, Witschaft, Mercosur, AfD, ",0.000690476190476183,0.8
287,@Ulrich_Oehme,"Ulrich Oehme, MdB",2015-07-20 17:50:22,"Ulrich Oehme, @AfDimBundestag-MdB | Bitte auch @AfD & @AfDKompakt folgen! https://t.co/mVD5hakXZR",3384795790,1092,266,225,https://pbs.twimg.com/profile_images/974633542318772226/4sV0sbEz.jpg,afd,1.0,0.0,0.023644036451850776,"9November, AfD, Berlin, AfD, Bundestag, AfD, Oehme, Europarat, Kinderehe, AfDimBundestag, Kinderehen, Böhmermann, UNMigrationspakt, AfD, Bundestag, Oehme, Migrationspakt, Landtag, AfD, LtNRW, AfD, Aussiedler, Spätaussiedler, KlamrothsKonter, AfD, AfD, AfD, Mädchenkongress, AfDwirkt, Berlin, EUropawahl, EU, Zensur, NZZ, SPD, Mädchenkongress, AfD, AfDwirkt, Grünen, GretaThunberg, Thunberg, AfD, Bundestag, Zensur, SPD, Euskirchen, Europawahl, Böhnke, AfD, ",0.11018518518518518,0.0
288,@WaldemarHerdt,"Waldemar Herdt, MdB",2015-07-20 19:02:56,"Waldemar Herdt, @AfDimBundestag-MdB. #AfD #Bundestag | Folgen Sie bitte auch @AfD, @AfDRus & @AfDKompakt. https://t.co/QS2dIZ5bsA",3384824825,1220,228,243,https://pbs.twimg.com/profile_images/917518602672263168/w8dKt-hR.jpg,afd,1.0,0.0,0.01857643464259207,"AfD, Syrien, Bundestag, Bundesregierung, AfD, Syrien, AfD, Bundestag, AfD, Europarat, Russland, AfD, AfD, Bundestag, AfD, Bundestag, Christenverfolgung, AfD, AfD, FroheWeihnachten, AfD, Heiligabend, AfD, AnneWill, AfD, BAMF, Berlin, ZukunftDeutschland, AfD, Kinderehen, Kindesmissbrauch, AfD, Aufschrei, Böhmermann, GegenKinderehen, Staatsfunk, gegenKinderehen, Kinderehe, Kindesmissbrauch, ReconquistaInternet, boehmermannsliste, BoehmermannGate, ReconquistaInternet, ZukunftDeutschland, ",0.1197953216374269,0.0
289,@WolfgangFuhl,Wolfgang Fuhl,2015-07-21 20:14:47,"Vater, Opa, Ehemann, Deutscher, Jude,",3386357374,371,68,10,https://pbs.twimg.com/profile_images/1097185092290654209/R6j0XLeS.png,afd,0.9,0.1,0.013226478378853799,"JAfD, erasmusstiftung, Berlin, Berlin, Fuhl, Juden, AfD, strompreiswahnsinn, CDU, AKK, SPD, ",0.10500000000000001,0.0
290,@Jan_Nolte_AfD,"Jan Nolte, AfD MdB",2015-08-08 17:13:12,Klarer Kurs für Deutschland! 🇩🇪,3408940048,1626,296,407,https://pbs.twimg.com/profile_images/1140574765956120578/710ZXpJa.png,afd,0.0,0.55,0.508578030380414,"Wunder, lockdown, Ministerpräsidentenkonferenz, Grundrechte, Öffnungen, Wirtschaftshilfen, Polizei, Gesetze, Migrationshintergrund, Rundfunk, Straftätern, Diktatur, Staat, Thüringen, Tabubruch, Dammbruch, Merkels, Tagesspiegel, Täter, Opfer, Identität, Deutschland, Regierungskritikern, Freiheit, Demokratie, Opposition, SPD, Bundestag, Demokratie, ",0.01087499999999999,0.44999999999999996
291,@vonGottberg_AfD,Wilhelm von Gottberg,2015-08-10 15:30:55,"MdB Wilhelm von Gottberg, Bundestagsabgeordneter der #AfD #Niedersachsen. | Nur Platzhalter-/Support-Acc., Kontakt also nicht hier, sondern an @AfDimBundestag.",3412973404,374,118,68,https://pbs.twimg.com/profile_images/913559294162997248/gpxFAZpG.jpg,afd,1.0,0.0,0.012029675884399032,"AfD, ltwnds2017, Landtagswahl, Niedersachsen, AfD, BesserfuerNiedersachsen, TrauDichDeutschland, LtwNds, LTWNDS17, BesserFuerNiedersachsen, AfD, Hampel, AfD, Nds, ltwnds, AfD, LtwNds, AfD, Salzgitter, AfD, Gauland, Macron, EuGH, AfD, LtwNds, AfD, LtwNds, AfD, LtwNds, Niedersachsen, AfD, Niedersachsen, AfD, ",0.022777777777777775,0.0
292,@Marc_Jongen,Marc Jongen MdB,2015-11-05 17:59:24,"MdB, Kulturpolitischer Sprecher der @AfDimBundestag, Mitglied in den Ausschüssen für Kultur & Medien und für Bildung, Forschung & Technikfolgenabschätzung",4121053541,2253,205,366,https://pbs.twimg.com/profile_images/1039155173258616832/PsvCKlSO.jpg,afd,0.1,0.05,0.1560724641232016,"Landtagswahl, badenwürttemberg, AfD, Impfpass, Demokratie, Duden, gendern, AfD, Freiheit, Impfpflicht, Grundrechte, BillGates, AfD, HolocaustGedenktag, Israels, AfD, lockdown, GreatReset, AfD, Trump, Zensur, Meinungsfreiheit, AfD, TrumpBanned, AfD, AfD, gender, AfD, Wissenschaft, Haushaltsdebatte, Haushalt2021, AfDBPT2020, Kalkar, afd, Corona, Weihnachten, AfD, AfD, Bundestag, Corona, Infektionsschutzgesetz, AfD, Corona, Infektionsschutzgesetz, AfD, Bevoelkerungsschutzgesetz, Grundrechte, Deutschland, Corona, AfD, jungeliberale, AfD, verhindern, Demokratie, Schaden, Corona, Lockdown2, AfD, Trumps, Pennsylvania, ",-0.07333333333333333,0.85
293,@Frohnmaier_AfD,Markus Frohnmaier,2015-11-07 00:49:32,"#MdB und Ihr Abgeordneter für den Landkreis #Böblingen.
https://t.co/NznVdR2809",4130621842,2605,193,1167,https://pbs.twimg.com/profile_images/999254973455060992/x4gxIE54.jpg,afd,0.0,0.6,0.15759230545622013,"Gysi, Lobbyarbeit, Linke, AfD, Verfassungsschutz, Schorndorf, Demokratie, Antifa, AfD, ltwbw21, Zwangsabgaben, GEZ, Trump, JoeBiden, USElectionResults2020, 2021Bundestagswahlen, Election2020results, ",0.018333333333333323,0.4
294,@HohmannMdb,Martin Hohmann,2019-08-08 13:31:21,"Kreissprecher #AfD Fulda, #MdB, Mitglied im Haushaltsausschuss, stv. Mitglied im Verteidigungs- & Petitionsausschuss im #Bundestag, Mitglied d. #AfDimBundestag",1159457070124605442,448,103,211,https://pbs.twimg.com/profile_images/1159785751082614784/VOEWdCBE.png,afd,0.1,0.0,0.4314842114954198,"AfD, Kurzarbeitergeld, Merkel, coronahilfen, corona, Altmaier, bundesregierung, Altparteien, Bundesregierung, Deutschland, Deutschland, Lockdown, bundesregierung, corona, inzidenz, Lockdown, Bundesregierung, AfD, Inzidenz, Haldenwang, Verfassungsschutz, Verdachtsfall, Beobachtung, AfD, Maassen, Bundesregierung, Deutschland, Strompreis, Bundesregierung, Hessen, cdu, bouffier, afd, corona, lockdown, Inzidenz, AfD, Hanau, spd, GEZ, Gesinnungsjournalisten, Dirlos, AfD, Aschermittwoch, Mierdel, lockdown, Inzidenz, Merkel, RKI, Wieler, Lockdown, Merkel, coronavirus, deutschlandimlockdown, lockdownverlaengerung, lockdown, bundesregierung, Merkel, lockdownverlaengerung, lockdown, CoronaGipfel, corona, merkel, bundesregierung, Bundestag, WDR, letzteinstanz, janinekunze, gottschalk, Rassismus, Lockdown, corona, coronavirus, bundesregierung, merkel, fulda, Einzelhandel, Fulda, ",-0.13106944444444443,0.9
295,@DrRobbySchlund,"Dr. Robby Schlund, MdB",2018-06-19 10:49:02,"ist ein deutscher Politiker (AfD) und seit 2017 Mitglied des Deutschen Bundestages.

is a German politician (AfD) and member of the German Bundestag since 2017.",1009025255753601024,241,11,29,https://pbs.twimg.com/profile_images/1009026870871027712/ezKLASMx.jpg,afd,0.0,0.0,0.022796429327042858,"Gera, Thueringen, Landtagswahl, AfD, MdB, grüngehtanders, Europawahl2019, AfD, Thüringen, AfD, Schmölln, Zeulenroda, Greiz, Ronneburg, UN, Migrationspakt, ",0.025,1.0
296,@WolfgangWiehle,"Wolfgang Wiehle, MdB",2018-06-04 15:14:43,"AfD-Politiker, Mitglied des deutschen Bundestages",1003656299589132291,1255,396,883,https://pbs.twimg.com/profile_images/1227626124743708672/QyCOP1-k.jpg,afd,0.0,0.15,1.678514085228894,"Kompass, Union, CDU, CSU, Gruene, AfD, Corona, Protest, AfD, Superwahljahr, CDU, CDUKorruption, AfD, ltwbw21, ltwrlp21, GruenGelb, FDP, Gruene, Briefwähler, AfD, GroKo, CDU, CSU, SPD, AfD, Straftat, Abgeordnetenbestechung, Borjans, AfD, Groko, AfD, Bundestagswahl, Merkel, Stau, München, Gruene, Vernunftwende, AfD, CDU, CSU, NieMehrCDU, NieMehrCSU, AfD, Verhüllungsverbot, Schweiz, Islam, Volksabstimmungen, Deutschland, AfD, FFP2, Aerosol, AfD, Bundestagwahl, Verfassungsschutz, Haldenwang, AfD, AfD, Bundestagswahl, Syrer, Flüchtlingshelferin, AfD, Gender, Thierse, SPD, FAZ, Austritt, AfD, Medien, Bild, Lockdown, Merkel, Spahn, Söder, AfD, Lockdown, Arbeitslosigkeit, AfD, ",0.01479166666666667,0.85
297,@DrHollnagel,Dr. Bruno Hollnagel,2018-05-15 17:21:29,Dies ist der offizielle Twitter-Kanal von MdB Dr. Bruno Hollnagel (AfD),996440442819502082,732,127,207,https://pbs.twimg.com/profile_images/1205426478235693057/j2jy5-NL.jpg,afd,0.1,0.0,0.1216449073149634,"Corona, Deutschland, Lockdown, AfD, Gauland, EU, Kredite, AfD, Hollnagel, Hollnagel, AfD, Corona, EU, Corona, EU, Corona, EU, Lockdowns, Medianvermögen, Bargeld, Giralgeld, Anonymität, Negativzinsen, Bundestag, Euro, Corona, Lockdown, Corona, Lockdown, Währungsreform, Lockdown2, Corona, Spahn, Corona, Corona, EU, Lockdown, Finanzen, Zinsdiktat, EZB, Bundestag, AfD, AfD, Corona, Lockdowns, Corona, Lockdown, Corona, ",-0.022305555555555558,0.9
298,@MdB_Mueller_AfD,"Hansjörg Müller, MdB",2018-02-19 14:19:01,Hier twittert der Aussenwirtschaftspolitische Sprecher der #afdimbundestag | Re-Tweets bedeuten nicht zwingend Zustimmung.,965591555783430144,1772,739,536,https://pbs.twimg.com/profile_images/1226107386374557697/I8Z4E1Jv.jpg,afd,0.0,0.0,0.22195193164372443,"Moskau, AfD, Merkel, EU, Überwachung, Impfung, Impfpass, Vollüberwachung, Aschermittwoch, AfD, Greding, Deutschland, BILDlügt, Lockdown, Milliarden, Wirtschaftskraft, Deutschlands, CoronaGipfel, Coronateralschaden, Shutdown, Flughafen, München, Wirtschaft, Menschenleer, mausetot, Corona, Coronateralschaden, Existenzvernichtung, Merkel, Verfassungsschutz, Merkel, Verfassungsschutz, Freiheiten, DDR, SED, FDJ, Kommunismus, Totalitarismus, Grundrechte, Grundgesetz, Deutschland, Land, deutsche, Volk, Wirtschaft, Merkel, Spahn, Laschet, Corona, Siechtum, Koma, Freiheits, DemokratieDemo, Wien, Müller, Alternative, AfD, China, USA, Linksfraktionen, Welthandel, Geldstrafen, Wirtschaft, Grünen, Bußgeldpartei, Bürger, Hotels, Gastronomie, Dienstleister, MerkelMussWeg, Ausgangsbeschraenkungen, coronamassnahmen, Regierungsversagen, Mittelstand, Existenzvernichtung, Denunzianten, TichysEinblick, WirMachenAuf, Corona, GEZ, StaatsFunk, BrandenburgerTor, Silvester, FPÖ, AfD, Corona, Hygiene, Coronateralschaden, ",0.03583333333333333,1.0
299,@JoernKoenigAfD,"Jörn König, MdB",2018-02-06 20:33:00,MdB und sportpolitischer Sprecher der @AfD Bundestagsfraktion. Weiterer Schwerpunkt: Digitale Finanzwirtschaft / Kreisvorsitzender Hannover Stadt.,960974630709284864,772,1,434,https://pbs.twimg.com/profile_images/960975567247020032/gIU_snrb.jpg,afd,0.0,0.0,0.030191421044311533,,0.006666666666666665,1.0
300,@Jacobi_AfD,Fabian Jacobi,2017-12-22 12:21:42,"Es ist nicht so leicht, normal zu werden.",944181149424898048,1641,42,829,https://pbs.twimg.com/profile_images/944184214110564352/lN5IAFug.jpg,afd,0.0,0.45,1.7479263479475857,"Satanismus, AfD, Hitler, Merkel, Verfassungsschutz, AfD, Verfassungsschutz, BfV, Beobachtung, Verdachtsfall, Haldenwang, Seehofer, Bundesregierung, Verwaltungsgericht, Köln, CDU, fdGO, gelenkteDemokratie, autoritärerStaat, ",-0.02,0.55
301,@Frank_Magnitz,"Frank Magnitz, MdB 🇩🇪",2017-12-12 10:43:44,"Für #Bremen im Bundestag @AfDimBundestag,",940532615177752576,1943,618,784,https://pbs.twimg.com/profile_images/940533284102172672/aOHJQnPT.jpg,afd,0.9,0.05,0.028732616663995906,"AfD, Staatszwangsfunkgebühren, AfDwirkt, Bremen, AfD, HBWahl, Bremenwahl, Bremenwahl, LtwBremen, Gehwaehlen, AfD, Bremen, LtwBremen, HBWahl, Bremenwahl, AfD, HBWahl, Bremenwahl, LtwBremen, AfD, Bremen, HBWahl, LtwBremen, Bremenwahl, AfD, LtwBremen, HBWahl, Bremenwahl, Bremen, AfD, LtwBremen, Bremenwahl, HBWahl, AfD, HBWahl, AfD, LtwBremen, Bremenwahl, Bremen, Diesel, Fahrverbote, Grenzwerte, HBWahl, AfD, LtwBremen, LtwBremen, Bremen, AfD, LtwBremen, HBWahl, Bremenwahl, Bremen, AfD, LtwBremen, HBWahl, Bremenwahl, Runge, AfD, LtwBremen, HBWahl, Bremenwahl, TagderArbeit, AfD, 1Mai, Bremerhaven, CDU, LtwBremen, AfD, HBWahl, Bremenwahl, Bremen, Ostersamstag, AfD, LtwBremen, HBWahl, Btremenwahl, AfD, Bundestag, HartzIV, Bremerhaven, LtwBremen, HBWahl, Bremenwahl, Galopprennbahn, LtwBremen, HBWahl, Bremenwahl, AfD, ",0.010416666666666668,0.04999999999999993
302,@HilseMdb,"Karsten Hilse, MdB",2017-10-19 08:38:55,,920932259347214338,383,121,17,https://pbs.twimg.com/profile_images/949306564795666435/pSdmFa5y.jpg,afd,0.0,0.17647058823529413,0.013688484333188063,,0.0,0.8235294117647058
303,@ChrWirthMdB,"Dr. Christian Wirth, MdB",2017-10-17 07:45:13,"Dr. Christian Wirth, für das #Saarland und die #AfD im Bundestag",920193967937019904,2442,303,508,https://pbs.twimg.com/profile_images/995708277068632068/lLUbfmx9.jpg,afd,0.8,0.05,0.2300594938330156,"AfD, Polizei, SPD, MoMa, AfD, coronavirus, AfD, Staatsversagen, AfD, Seehofer, Reul, Kompetenz, AfD, Bundestag, AfD, Bundestag, SED, AfD, Bundestag, Heimat, Familien, Weihnachten, bundestag, ",0.05411111111111111,0.1499999999999999
304,@Martin_Sichert,"Martin Sichert, MdB",2017-10-12 09:19:55,Hier twittern Martin Sichert (ms) und sein Team (ts).,918405860862382082,2410,227,776,https://pbs.twimg.com/profile_images/1181188989556002817/pTebSp6j.jpg,afd,0.05,0.35,0.22411167091306622,"lockdown, corona, Absurd, OEffnungen, Corona, lockdown, ZweiklassenGesellschaft, coronavirus, niewiederSPD, coronavirus, CuomoCoverup, Trump, alternativefacts, alternativenews, Inzidenzwert, Freiheit, GenderGaga, Elfenbeinturm, lockdownbeenden, NoCovid, lockdownbeenden, LockdownForever, lockdownverlaengerung, niewiedercdu, niewiederSPD, Corona, Impfungen, MerkelMussWeg, Ausgangssperren, annewill, Ausgangssperren, Merkel, Neuinfektionen, Ohanwe, ",0.005499999999999995,0.6000000000000001
305,@JuergenBraunAfD,"Jürgen Braun, MdB",2017-10-10 14:18:46,@AfDimBundestag-Abgeordneter WK Waiblingen | Stellv. Vorsitzender Ausschuss für #Menschenrechte im Deutschen #Bundestag | https://t.co/ha37EmHiaH,917756296555892736,3319,541,6782,https://pbs.twimg.com/profile_images/918695480342675456/X2joWgow.jpg,afd,0.55,0.05,8.566538236023218,"Laschet, Scholz, Merkel, Landtagswahlen, Kanzler, Kohl, ltwbw21, ltwrlp21, Kretschmann, Landtagswahl2021, ltwbw21, Heute, Merkel, Spahn, FakeNews, Lockdowns, ltwbw21, AfD, Landtagswahl, grünen, CDU, FDP, Schorndorf, Antifa, AfD, ltwbw21, ltwbw, AfD, ltwbw21, Zufall, Merkel, GEZ, Medien, Relotius, AxelSpringer, Reichelt, AfD, Landtagswahl, grünen, CDU, FDP, Schorndorf, Antifa, AfD, ltwbw21, ltwbw, AfD, Medien, Fellbach, Alternative, grünen, ltwbw21, Endspurt, Landtagswahl, Fellbach, MarcMaier, Lockdown, Impfzwang, AfD, grünen, ltwbw21, LTW2021, Waiblingen, Infostand, Schorndorf, Antifa, Krankenhaus, AfD, Landtag, ltwbw21, ltw21, ltwbw, AfD, ltwbw, Schorndorf, AfD, AntifaTerrorists, Ohanwe, IdiAmin, Merkel, Hatespeech, AfD, AfD, Ohanwe, ",0.05458333333333334,0.3999999999999999
306,@KestnerJens,Jens Kestner,2017-10-08 08:05:34,Jens Kestner Bundestagsabgeordneter #Goslar - #Northeim - #Osterode WK 52 und Landesvorsitzender der #AfD #Niedersachsen hier und selbst am twittern 🇩🇪,916937598232391680,1097,620,853,https://pbs.twimg.com/profile_images/1269638960516665346/tghJgPXJ.jpg,afd,0.45,0.0,0.39639779360080896,"Orwel, AfD, ARD, ZDF, Leopard, Heer, Wochenende, PanzerHurra, OverAndOut, Merkel, Regierungserklärung, Lockdownverlaengerung, Bundesregierung, Panikmache, Risikogruppen, Lockdown, AfD, Propaganda, Mainstream, Deutschlandretter, AlternativefürDeutschland, Chicago, Berlin, Aufmachen, KESTNER, AfD, Niedersachsen, Zivilcourage, Heer, Klasse, Bundestag, KESTNER, AfD, Corona, coronavirus, PolitikundAlternative, Podcast, AfD, Lockdown, Trump, Kaiserreich, Sottrum, Merkel, Antifa, AfD, Neusprech, Altsprech, ",0.137,0.55
