,name_id,name,created_at,desc,u_id,num_followers,num_following,num_tweets,img,partei,retweet_rate,replie_rate,ts_perday,hashtags,avg_sent,tweet_rate
0,@johannesvogel,Johannes Vogel,2008-07-28 12:19:51,"MdB, Generalsekretär der FDP NRW und Mitglied des FDP-Bundesvorstandes. Sprecher für Rente & Arbeitsmarkt. Es schreiben Johannes & Team. Impressum siehe Website",15630931,20419,3526,15604,https://pbs.twimg.com/profile_images/1065240146335944704/mDGJ6rNY.jpg,fdp,0.2,0.45,8.319877501722782,"ltwbw21, ltwrlp21, ltwbw21, ltwrlp21, kommunalwahl2021, Wahltag, Landtagswahl2021, ltwbw21, Corona, ",0.15666666666666668,0.35
1,@solms,Hermann Otto Solms,2008-09-17 07:49:56,Mitglied des Deutschen Bundestages und Ehrenvorsitzender der @FDP.,16325209,7743,659,1988,https://pbs.twimg.com/profile_images/1125396054634106880/Eknmxhp9.png,fdp,0.3,0.1,0.30612852273803587,"ltwbw21, ltwrlp21, kommunalwahl2021, Wahltag, Landtagswahl2021, Coronahilfen, Pandemie, SPD, Mindestlohn, Rezession, Impfungen, MPK, Tierwohl, Steuererhöhungen, Bundesregierung, Impfdesaster, Corona, Teststrategie, Stufenplan, Öffnung, Bundesregierung, Impfungen, Perspektiven, Neustart, Corona, Impfung, Wirtschaft, Verwaltung, Impfchaos, Bildungschaos, impfen, Impfgipfel, Novemberhilfen, CDU, FDP, Wirtschaft, Regierungserklärung, Kaufprämie, Elektroauto, Corona, Gießen, ",0.016476190476190474,0.6
2,@florian_toncar,Florian Toncar,2008-11-18 10:55:06,Parlamentarischer Geschäftsführer & finanzpolitischer Sprecher der Fraktion der Freien Demokraten (FDP) im Deutschen Bundestag. Das Team twittert unter (TT),17462171,6496,1259,2727,https://pbs.twimg.com/profile_images/1205066997865832448/qVqYc0Ao.jpg,fdp,0.35,0.1,4.539302463632157,"Wahlabend, Böblingen, Alber, Scheerer, REDEZEIT, Schittenhelm, Teststrategie, Wirecard, wirecard, Fintech, Wirecard, Podcast, Wirecard, Bonath, FDP, Landtagswahl, Wirecard, Wirecard, Insolvenz, Commerzbank, Rettungsplan, Skandal, WirecardSkandal, Untersuchungsauschuss, Wirecard, Bafin, Bundesbank, Staatsanwaltschaft, Wirecard, BPK, Wirecard, ",0.09333333333333334,0.55
3,@ManuelHoeferlin,Manuel Höferlin,2008-11-19 10:16:23,Vors. Ausschuss Digitale Agenda @bundestag - Digitalpol. Sprecher @fdpbt #digitalisierungskämpfer #itunternehmer #papa #rheinhesse #sportpilot #hobbyimker,17483463,6466,1054,4211,https://pbs.twimg.com/profile_images/912621016920264705/FgHbaT7K.jpg,fdp,0.45,0.05,1.000536492270318,"Frauentag, YesSheCan, WeltFrauenTag, Empowerment, FreieDemokraten, Kanzlerin, Merkel, Taskforce, Spahn, Scheuer, Corona, Selbsttests, Ausweispflicht, Klarnamenpflicht, Digitalministerium, Deutschlandkanndigital, ITSiG20, Bundesregierung, ITSig20, bundestag, BSI, ITSiG, Öffnungsstrategie, Freiheit, Grundrechte, Parlament, Merkel, Regierungserklärung, MPK, Perspektiven, Digital, fdp, Corona, Perspektiven, Digitalministerium, Netzgeschichten, Netzgeschichten, Netzpolitik, ",0.12116666666666664,0.5
4,@christianduerr,Christian Dürr,2008-11-21 13:20:23,Fraktionsvize bei der @fdpbt | Haushalt & Finanzen | Niedersachsen,17535941,4954,1144,2049,https://pbs.twimg.com/profile_images/1128642556865253378/qO_uh_sA.jpg,fdp,0.15,0.35,1.9405817145719335,"ltwbw21, ltwrlp21, ltwbw21, ltwrlp21, LunchMeeting, Coronahilfen, R2G, Scheuer, ",0.15666666666666665,0.5
5,@torstenherbst,Torsten Herbst MdB,2008-11-22 19:02:47,Bundestagsabgeordneter @fdpbt | Obmann im Ausschuss für Verkehr und digitale Infrastruktur @Bundestag | Bundesvorstand @fdp | Landesschatzmeister @fdpsachsen,17561226,2399,421,1672,https://pbs.twimg.com/profile_images/1201608686151577601/_VAdrhZF.jpg,fdp,0.05,0.2,3.236719863522697,"Freiheit, Sachsen, FakeNews, Fukushima, Sachsen, Mittelstand, Handwerk, Handwerkskammer, Dresden, HWK, Coronahilfen, Pandemie, Sachsen, Clubhouse, futureofmobility, mobility, ",0.14270833333333333,0.75
6,@Otto_Fricke,OttO Fricke,2008-12-11 09:50:36,"Freiheitsfreund, MdB, Haushälter, Mitglied Bundesvorstand FDP und Landesschatzmeister NRW sowie immer wieder etwas über die Niederlande",18044683,12936,381,11692,https://pbs.twimg.com/profile_images/1191357347421179904/ph-oARwk.jpg,fdp,0.3,0.6,5.057141224244132,"Aufbaufonds, EU, Sachsen, ",0.03708333333333334,0.10000000000000009
7,@f_schaeffler,Frank Schäffler,2008-12-17 14:10:38,"MdB, FDP - „Es ist eine Hauptaufgabe des Wettbewerbs zu zeigen, welche Pläne falsch sind.“ F. A. von Hayek",18189342,14822,5672,8526,https://pbs.twimg.com/profile_images/1045585035913564161/bk4SSEm8.jpg,fdp,0.4,0.05,1.9689924777715155,"FDP, ltwbw21, Regierungsversagen, Mietendeckel, enteignung, vergesellschaftung, mietenwahnsinn, dwenteignen, Regierungsversagen, Regierungsversagen, Doppelbesteuerung, Sozialismus, Weltfrauentag, maybritillner, Quadir, Wirecard, ",0.04541666666666667,0.55
8,@KatjaSuding,KatjaSuding,2009-01-11 21:36:34,Stellv. Vorsitzende der FDP-Bundestagsfraktion • Stellv. Bundesvorsitzende der FDP • Landesvorsitzende der FDP Hamburg,18880634,13007,478,3665,https://pbs.twimg.com/profile_images/1235584633997340673/n56gtN8J.jpg,fdp,0.15,0.6,2.8067832973626916,"Corona, Antidiskriminierungsstelle, EqualPayDay, Frauen, EqualPayDay, EqualPayDay, Fehlanreize, Sorgearbeit, Weltfrauentag, InternationalWomensDay, WomenSupportingWomen, Weltfrauentag, IWD2021, Weltfrauentag, IWD21, Weltfrauentag, IWD21, Weltfrauentag, iwd2021, Weltfrauentag, iwd2021, Weltfrauentag, IWD21, Weltfrauentag, iwd2021, Weltfrauentag, iwd2021, Weltfrauentag, Gleichberechtigung, YesSheCan, ",0.075,0.25
9,@PascalKober,Pascal Kober MdB,2009-02-02 14:54:57,MdB II FDP II Sozialpolitischer Sprecher II Stellvertretender Präsident Reservistenverband II 🏃🏼‍♂️ II 🏇🏻 II 🪂,19909974,463,157,140,https://pbs.twimg.com/profile_images/1318164351816183808/qQIUPhx9.jpg,fdp,0.25,0.25,0.6678798809787506,"Kinderschutzbund, FDP, Kinder, fdpbt, Bundeswehr, socialmediadivision, diereserve, vdrbw, bundeswehrverband, soldaten, soldatinnen, Reservist, reservistin, Landwirtschaft, Corona, Öffnungen, Stufenplan, Sozialschutzpaket, Grundsicherung, Soloselbständige, Unternehmerlohn, Kanzlerin, Öffnungsschritte, Grundeinkommen, bge, sozialpolitik, WirGegenExtremismus, Bundeswehr, WirBeziehenStellung, PISA, Kindergipfel, Wirtschaftsgipfel, ",0.08895833333333333,0.5
10,@OlliLuksic,Oliver Luksic,2009-02-17 23:17:52,"Verkehrspolitischer Sprecher @fdpbt, Vorsitzender FDP Saar. Fan von #Effzeh und #BaMore",21144568,10531,3404,41216,https://pbs.twimg.com/profile_images/1073118794023878656/-a_e3_kR.jpg,fdp,0.65,0.05,15.293824997718302,"Landtagswahl2021, ltwbw2021, ltwrlp21, NoAfD, Landtagswahl2021, ltwbw21, ltwrlp21, ltwbw21, Danke, ltwbw21, ltwrlp21, Kommunalwahl2021, Corona, DIESEeG, ",0.08575000000000002,0.29999999999999993
11,@KatrinHelling,Katrin Helling-Plahr,2009-02-19 02:19:12,"Mitglied des Deutschen Bundestages, Ausschuss für Recht und Verbraucherschutz, Ausschuss für Gesundheit, Rechtsanwältin, junge Mama",21267421,2192,903,1808,https://pbs.twimg.com/profile_images/997817172222205952/w-IgF3Z6.jpg,fdp,0.25,0.25,1.7935619516498822,"FDP, btw2021, Scheidungsrecht, Hausärzte, Impfen, Coronahilfen, Pandemie, Gesundheitsministerium, Maskenaffäre, Suizidhilfe, Selbstbestimmung, Betreuungsrecht, PetraStudie, Umgangsrecht, Wechselmodell, getrenntgemeinsamErziehen, Selbstständige, IfSG, Pandemie, Schnelltests, Corona, LegalTech, ",0.16326388888888888,0.5
12,@MarcusFaber,Marcus Faber,2009-03-01 13:59:34,"Dr. Marcus Faber, MdB | Für Sachsen-Anhalt im Bundestag l FDP Bundesvorstand | stellv. Landesvorsitzender FDP Sachsen-Anhalt @fdp_lsa l Verteidigungsausschuss",22364234,2640,996,6456,https://pbs.twimg.com/profile_images/1290386437934915584/QT0oDVUR.jpg,fdp,0.3,0.05,0.5858643644453403,"Coronakrise, fdpkpt21, Drohnen, faberhaft, Israel, DIG, hishig, MeinTwitterJubilaeum, sachsenanhalt, bildung, SachsenAnhalt, fdplsa, fdp, FreiDemokraten, Landtagswahl, ltw21, ModernMachen, Steinmeier, BioNTech, Türeci, Şahin, Bundesverdienstkreuz, Verteidigungsausschuß, KSK, Kanzlerin, strategie, Digitalpakt, Kooperationsgebot, moderneDidaktik, Hanau, SayTheirNames, halle, Impfaffäre, corona, Kubicki, Schutz, Impfungen, Öffnungsperspektiven, Kinder, Wirtschaft, Merkel, Lockdown, Stufenplan, SachsenAnhalt, barrierefrei, ",0.04895833333333333,0.65
13,@cad59,Christine Aschenberg-Dugnus MdB,2009-03-23 10:24:55,"#Rechtsanwältin, Vorsitzende #LFA #Gesundheitspolitik S-H, Vorsitzende #BFA #Gesundheitspolitik, #MdB, #gesundheitspolitische #Sprecherin der @fdpbt",25980076,1931,159,1856,https://pbs.twimg.com/profile_images/1064839343792103424/Zv0fviCH.jpg,fdp,0.4,0.1,0.9913296801947848,"fdpbt, Verhältnismäßigkeit, fdpbt, fdpbt, Impfstrategie, Bundestag, EpidemischeLage, Coronavirus, Impfpass, Digitalisierung, Corona, Impfstrategie, Öffnungsperspektive, öffnungsstrategie, fdpbt, Bundestag, Lockdown, Stufenplan, Merkel, Regierungserklärung, öffnungsperspektive, stufenplan, fdpbt, ntv, Stufenplan, Österreich, Dänemark, Schnelltests, Lockdown, Bundestag, fdpbt, lockdown, öffnungsperspektive, Stufenplan, Bundestag, Spahn, Impfstoff, Impfstoff, fdpbt, Gesundheitsausschuss, CDU, ",0.08524999999999999,0.5
14,@franksitta,Frank Sitta,2009-04-01 11:12:09,Stellvertretender Fraktionsvorsitzender @fdpbt | Mitglied des Deutschen Bundestages (MdB) | Kreisvorsitz @fdpHalleSaale,28087038,3392,1836,8822,https://pbs.twimg.com/profile_images/1042769132461215744/i5jFqtrR.jpg,fdp,0.95,0.0,1.6403907339018775,"presseclub, Impfaffäre, Halle, BadenWürttemberg, RheinlandPfalz, Lockdown, Einzelhandel, Innenstädte, Merz, Bundestag, Digitalisierung, Orban, Impfaffäre, Halle, Wiegand, Biden, Impfstoff, Impfdesaster, Umweltausschuss, Bundestag, Schnelltests, Lockdown, MPK, Regierungsversagen, wiegand, Impfaffaere, ",0.03770833333333333,0.050000000000000044
15,@DanielaKluckert,Daniela Kluckert,2009-04-02 12:28:07,"FDP-Bundestagsabgeordnete, stellv. Vors. des Verkehrsausschusses, Vorsitzende FDP Pankow, stellv. Landesvorsitzende FDP Berlin / es twittert DK selbst",28327765,3871,851,1897,https://pbs.twimg.com/profile_images/921316851765870592/k6SxJEac.jpg,fdp,0.2,0.3,0.5226166677291963,"Pankow, berlin, fdp, Deutschland, Berlin, Pankow, PBefG, FDP, PBefG, PBefG, FDP, PBefG, PBefG, Kretschmer, Woidke, Tourismus, Ostern, BER, Berlin, Brandenburg, Bund, Steuergeld, ltwbw, covid19, ",0.14905555555555555,0.5
16,@bstrasser,Benjamin Strasser,2009-04-07 20:46:18,"mitglied @bundestag | innenpolitiker | religionspolitischer sprecher, obmann innenausschuss & #ua1bt @fdpbt | präsident @bmco_verband | oberschwabe | ts = team",29540300,4235,2032,2950,https://pbs.twimg.com/profile_images/1111587557236764672/mMHXY2tI.png,fdp,0.2,0.35,0.8710068330961944,"Landtagswahl, BW, ltwbw21, ltwbw21, ltwbw, Frauentag, Empowerment, YesSheCan, Nüßlein, Loebel, ltwbw21, Corona, Lockdown, Live, AfD, Krisenstrategie, Perspektiven, corona, mpk, AfD, Beobachtung, Rechtsextrem, Neustart, Perspektiven, ",0.04333333333333334,0.44999999999999996
17,@starkwatzinger,Bettina Stark-Watzinger,2009-05-06 17:25:30,MdB • Freie Demokratin • Parlamentarische Geschäftsführerin der @fdpbt • Bürgerin • Aus vollem Herzen Mutter,38228691,5350,802,2694,https://pbs.twimg.com/profile_images/1265936066068037632/bo1KR0di.jpg,fdp,0.1,0.45,4.48479189019914,"Dank, Kommunalwahl, ltwbw21, ltwrlp21, SeiDabei, FDPOnAir, Wahltag, Live, FDP, Gesundheit, Bildung, Arbeitsplätze, Freiheit, coronavirus, ltwbw21, ltwrlp21, kommunalwahl2021, Coronahilfen, Bundesregierung, Selbsttests, Startup, Scholz, Altmaiers, Coronahilfen, Pandemie, ",0.23924999999999996,0.44999999999999996
18,@StephanThomae,Stephan Thomae,2009-09-17 12:59:49,Mitglied des Deutschen Bundestages. Stellvertretender Fraktionsvorsitzender der FDP-Fraktion im Deutschen Bundestag,75005687,3064,811,2239,https://pbs.twimg.com/profile_images/975732155941867522/bq8kjKM8.jpg,fdp,0.0,0.0,1.1482914939567648,"FDP, Landtagswahl, CDU, CSU, Ehrenerklärung, negativgewinnsteuer, Coronahilfen, Korruption, Transparenzregister, Nüßlein, Löbel, Amthor, Korruption, Maskenaffäre, AfD, Verfassungsschutz, MPK, Lockerungen, Stufenplan, Schnelltest, EVP, Fidesz, Orbán, AfD, Verdachtsfall, Verfassungsschutz, Inzidenzwert, Lockerungen, lockdown, Russland, Putin, Nawalny, Lockdown, FDP, Bürgerrechten, Verweilverbot, SPD, Wohnungsbaupolitik, Linksextremismus, Islamisten, Freiheitsrechte, CSU, Distanzunterricht, Pandemiebekämpfung, Impfreihenfolge, ",0.03311111111111111,1.0
19,@hacker_fdp,Thomas Hacker,2009-11-11 15:32:20,MdB für Oberfranken • Medienpolitischer Sprecher @fdpbt • Chef FDP/DU/FL-Fraktion Stadtrat Bayreuth • Präsident @TDStiftung. Hier twittern er (TH) und Team (TT),89209507,1779,709,3871,https://pbs.twimg.com/profile_images/1266336597517238272/Ng3_cwF4.jpg,fdp,0.5,0.05,4.714734065657694,"FDP, ltwrlp21, ltwbw21, Gastronomie, Impfen, Corona, OERR, Steinmeier, Masken, Kultur, Belarus, Brasilien, Minecraft, TheUncensoredLibrary, TruthFindsAWay, Games, Framlocker, Presseförderung, Ungarn, Polen, Rechtsstaatsmechanismus, Bundesregierung, DSDS, Janosch, Tigerente, Kraftwerk, Clubkultur, Coronahilfen, Lockdown, Novemberhilfen, ",0.12004166666666667,0.44999999999999996
20,@MarcoBuschmann,Marco Buschmann,2010-01-18 16:25:00,1. Parlamentarischer Geschäftsführer der Fraktion der Freien Demokraten. Mitglied des Deutschen Bundestags. Es twittern Marco Buschmann und Team Buschmann (TB).,106136813,18211,2052,17371,https://pbs.twimg.com/profile_images/928638710681399297/0r3A40L4.jpg,fdp,0.05,0.45,6.418261028898276,"Landtagswahlen2021, LandtagswahlBW, LandtagswahlRLP, NoAfD, Landtagswahl2021, ltwbw21, ltwrlp21, Landtagswahl2021, ltwrlp21, Landtagswahl2021, ltwbw21, Covid_19, noAfD, Impfgipfel, Impfgipfel, ",0.01833333333333333,0.5
21,@fdp_hessel,Katja Hessel,2010-01-23 20:19:09,"MdB, Vorsitzende Finanzausschuss, Kreisvorsitzende FDP Nürnberg, Staatssekretärin a.D.",107806591,1330,99,479,https://pbs.twimg.com/profile_images/3436992951/36c249741be48a297769de69c82c5a86.jpeg,fdp,0.05,0.35,0.6174189339580998,"Finanztransaktionssteuer, Spekulationsfrist, CoronaHilfen, Corona, MarijaKolak, Weltfrauentag, CoronaTaskforce, VulkanPacaya, Guatemala, nextgeneration, Perspektive, Digitalisierungsflop, Impfstoffe, Coronatests, Literaturschnellball, Literaturschnellball, vPAM, Kretschmann, Merkel, ",0.07458333333333333,0.6000000000000001
22,@c_lindner,Christian Lindner,2010-03-11 16:11:51,Bundesvorsitzender der Freien Demokraten. Vorsitzender der Fraktion im Bundestag. Es twittern er selbst (CL) und sein Team (TL).,122104353,438980,1366,17028,https://pbs.twimg.com/profile_images/1284030077219602432/hq24Ijui.jpg,fdp,0.4,0.1,2.020090604728076,"Danke, ltwbw21, ltwrlp21, Kommunalwahl2021, Nawalny, FreeNavalny, Wahltag, Wahlrecht, Impfturbo, Impfgipfel, Hausärzte, Impfdosen, Biden, Arztpraxen, Lockdown, Coronahilfen, Pandemie, Habeck, Kommunalwirtschaft, Gesundheitsministerium, Maskenaffäre, FDP, LTWRP21, ltwbw, Kommunalwahl, kommunalwahl2021, kw21, Nuesslein, Loebel, Bundesregierung, Maskenaffäre, Bundestagswahl, Weltfrauentag, Nawalny, FreeNavalny, lockdown, Schnelltest, Inzidenz, Lockerungen, Corona, illner, maybritillner, Schnelltests, lockdown, Inzidenz, Lockerungen, Corona, illner, ",0.130125,0.5
23,@Lambsdorff,Alexander Lambsdorff,2010-05-28 23:15:13,"Stv. Vorsitzender, #FDP im #Bundestag; Vice President #ALDE Party 🗽 Autor “Wenn Elefanten kämpfen” bei #Ullstein 🐘 RT kein/no endorsement. All tweets by me.",149299258,20265,643,6352,https://pbs.twimg.com/profile_images/449133810290933760/8JRWYdpF.jpeg,fdp,0.05,0.5,4.48393981605767,"FDP, FDP, ltwrlp, ltwbw21, FDP, Landtagswahlen, BadenWürttemberg, RheinlandPfalz, RheinlandPfalz, BadenWürttemberg, Freiheit, ltwbw21, ltwrlp21, Bohlen, Theurer, Corona, Impfstoff, ImpfenSchuetzt, FDP, CDU, Aserbaidschan, Desinformation, Fukushima, Parteichefin, NRW, Corona, COVID19, Pflichtlektüre, USA, Identitätspolitik, Impfen, ",0.14291666666666666,0.44999999999999996
24,@LindaTeuteberg,Linda Teuteberg,2010-07-26 06:31:36,#Brandenburgerin | Bundestagsabgeordnete #WK61 | Ausschuss für Inneres und Heimat | Migrationspolitische Sprecherin @fdpbt | Landesvorsitzende @FDP_Brandenburg,170964436,17623,170,1791,https://pbs.twimg.com/profile_images/910070539968008193/UVT_tx4w.jpg,fdp,0.3,0.15,1.6090485720130734,"FDP, FreieDemokraten, DerImpulsFürsLand, AusTieferVerantwortung, WasWirklichZählt, Nationalismus, Orwell, Patriotismus, Lieberknecht, Gleicke, Terror, Westen, Freiheit, Islamismus, Verfassung, Debatten, TeutebergTalk, GG, FDGO, Migration, Rechtsstaat, Europa, Integration, FDP, Weltfrauentag, InternationalWomensDay, unterdenlinden, FrauenPower, phoenixUnterDenLinden, Weltfrauentag, EU, GEAS, Asyl, UnterDenLinden, Brandenburgerin, Luxemburg, FDGO, FreiheitDieWirMeinen, GegenVergessenFürDemokratie, Churchill, Westen, FlirtMitDemAusnahmezustand, Habeck, ",-0.015583333333333334,0.55
25,@jensbeeck,Jens Beeck,2010-08-16 20:00:42,Mitglied des Bundestages | Teilhabepolitischer Sprecher @fdpbt ♿️ | Fraktion der Freien Demokraten | Mittelems | https://t.co/V7gk2SNjxC,179216369,1216,237,208,https://pbs.twimg.com/profile_images/942339656703729664/CQu0C247.jpg,fdp,0.3,0.0,0.17495591558144738,"Myanmar, AfD, StandWithMyanmar, Myanmar, Merkel, Lockdown, Stufenplan, Regierungserklärung, Bundestag, Altmaier, Schuldenbremse, schwarzeschulden, Demokratie, Inauguration2021, Treueschwur, Gebärdensprache, InaugurationDay, MPK, Bundestag, Müller, BMZ2030, Demokratie, Populismus, WashingtonDC, Risikogruppe, Impfung, STIKO, Behinderung, Corona, Impfung, Arbeitsschutzkontrollgesetz, GroKo, Behinderungen, Gastronomen, Lingen, Lüneburg, Geschäfte, Einzelhandel, Innenstädte, FDP, Corona, Opposition, ",0.18187499999999998,0.7
26,@DFoest,Daniel Föst,2011-11-27 12:17:53,"Vorsitzender @fdpbay, Mitglied des Bundestags, Bau- & wohnungspolitischer Sprecher @fdpbt, Familienmensch, Whiskysammler",422569574,7038,3552,16556,https://pbs.twimg.com/profile_images/1351832162094489600/hJrnaIsx.jpg,fdp,0.2,0.4,2.8073323097563647,"FDP, FDP, Landtagswahl2021, Impfturbo, Impfgipfel, Soeder, CSU, Aserbaidschan, Bauministerium, Umwandlungsverbot, Bundesregierung, Selbsttests, Corona, Familienpolitik, 10PunktePlan, Familienrecht, Maskengate, CSU, Amigos, Körber, München, Staatsversagen, ",0.0675,0.3999999999999999
27,@KonstantinKuhle,Konstantin Kuhle,2012-01-26 21:49:02,Südniedersachsen im @bundestag • Innenpolitischer Sprecher @fdpbt • ❤️🇪🇺 • Generalsekretär @fdp_nds • @PACE_News • Rechtsanwalt,475275997,30109,4268,11294,https://pbs.twimg.com/profile_images/1343321234663157761/dXEDmir3.jpg,fdp,0.15,0.45,5.048569778393582,"Corona, In50PodcastsdurchdasJahr, ",0.0012500000000000011,0.4
28,@MTodtenhausen,Manfred Todtenhausen,2012-04-26 13:03:53,FDP Bundestagsabgeordneter Elektromeister. Sprecher und Obmann für Petitionen. Vorsitzender AG Handwerk. Mitglied im Wirtschaftsausschuss #machenwireseinfacher,563706584,1386,1445,2208,https://pbs.twimg.com/profile_images/891681640170369024/CzNaQHP_.jpg,fdp,0.05,0.1,0.8125618629753368,"Bundestag, Wirtschaftshilfen, Unternehmerlohns, Wuppertal, Bundestag, Digitalpakt, Kooperationsgebot, NRW, ",0.049416666666666664,0.85
29,@UllmannMdB,Andrew Ullmann 😷,2012-06-16 10:47:11,"Obmann im Gesundheitsausschuss für @FDPBT & UA Globale Gesundheit, Kreisvorsitzender FDP WÜ, Bezirksvorstand Ufr, Stadtrat, Internist, Optimist, Vater 🇺🇸🇩🇪",609972369,2250,596,2680,https://pbs.twimg.com/profile_images/1221237863657832448/Tw_EXKn2.jpg,fdp,0.2,0.15,1.550352143653774,"RLP, BaWü, Walgreens, COVID19, SPD, AfD, FDP, Murmeltier, Finanzierung, Pflegekosten, BDI, InternistInnen, Amthor, Nüsslein, Löbel, Fischer, Bundesregierung, ",0.01958333333333333,0.65
30,@EUTheurer,Michael Theurer,2013-01-21 08:00:48,"Stv. Vorsitzender FDP-Bundestagsfraktion, FDP-Präsidiumsmitglied, Landesvorsitzender FDP BaWü, Verheiratet, 1 Kind",1108382916,6265,2588,3199,https://pbs.twimg.com/profile_images/900641140159983616/oyYRBEXi.jpg,fdp,0.4,0.15,0.9953185121361884,"fdpbw, fdp, ZDFmoma, Coronahilfen, derimpulsfürsland, ltwbw21, BadenWuerttemberg, Corona, Öffnungsperspektive, Lockdown, Teststrategie, Entlasten, entfesseln, investieren, Vermögenssteuer, fdpbt, Impfdesaster, Bundesregierung, Impfstoff, Corona, ltwbw21, derimpulsfürsland, Hauptstadt, Pflegeversicherung, HauptstadtDasBriefing, Wirtschaftsweise, GroKo, fdp, Fortschrittsbeschleuniger, fdpbt, CDU, ",0.06770833333333333,0.44999999999999996
31,@th_sattelberger,Thomas Sattelberger,2013-03-24 20:28:01,"Mitglied des Deutschen Bundestages (FDP, München-Süd); ehem. Personalvorstand bei Dt. Telekom AG und Continental AG #notiTSen #ZukunftBrauchtMacher",1296544153,15183,9831,9150,https://pbs.twimg.com/profile_images/872078177073496064/4fzWZYnE.jpg,fdp,0.25,0.4,3.8902196110294702,"BTW2021, Wissenschaftspolitik, Clubhouse, LernDNA, Bildung, nichtsbegriffen, ",0.07214285714285713,0.35
32,@GydeJ,Gyde Jensen,2013-06-19 08:11:12,Für SH @bundestag • Vorsitzende Ausschuss für Menschenrechte/humanitäre Hilfe🌐• human rights • @MunSecConf Young Leader 2020 • NATO2030 Young Leader • @fdpbt,1530171613,9254,1052,2313,https://pbs.twimg.com/profile_images/1259584014035365888/DNUbmkAW.jpg,fdp,0.3,0.3,1.4074789793407236,"Putin, Magnitsky, humanrights, Putin, Kreml, Hongkong, SPD, AfD, FDP, SheWillBeHeard, Frauentag, Hongkong, Patriotengesetz, Hongkong, HongKong, China, Corona, IPAC, Hongkong, ",0.13658333333333333,0.4
33,@AKulitz,Alex Kulitz,2013-09-07 08:11:42,Außenhandelssprecher der FDP BT Fraktion | Mitglied Auswärtiger Ausschuss | Bild Johannes Wosilat | Hier twittern Alexander Kulitz (AK) und sein Team (TK).,1743275384,401,497,290,https://pbs.twimg.com/profile_images/1143479776579084288/igMvoOMh.png,fdp,0.35,0.0,0.5401170984111325,"Innovation, Ulm, Wirtschaft, Klimaschutz, Diesel, Europa, Mercosur, Freihandel, CETA, Freihandel, Gorbatschow, Menschenrechte, Freihandel, Elektromobilität, Europa, Hanau, SayTheirNames, Aschermittwoch, Freihandel, RedHandDay, Kindersoldaten, EU, Freihandel, regierungserklärung, Impfstrategie, GroKo, regierungserklärung, regierungserklärung, lockdownverlaengerung, Bundestag, Newsletter, Corona, FDP, Inzidenz, Stufenplan, Freiheit, Verantwortung, Ökologie, Landwirtschaft, Freihandel, Familienunternehmen, Ökonomenblog, skills, BuildBackBetter, Youthwise, WES2021, ",0.09195833333333334,0.65
34,@PeterHeidtFDP,Peter Heidt,2013-09-12 21:46:41,Mitglied des Deutschen Bundestages @fdpbt. Es twittern Peter Heidt und Team PH (TH). FDP Stadtverordneter #wetterau Kreistagsfraktionsvorsitzender,1858621434,622,577,555,https://pbs.twimg.com/profile_images/1171047392705208321/Gs2jbL-R.jpg,fdp,0.1,0.15,1.4777775898418783,"kommunalwahl, fdp, waswirklichzählt, Kommunalwahl, fdp, waswirklichzählt, FDP, Kommunalwahl, waswirklichzählt, Chancen, HongKong, Tibet, FreeTibet, GeorgeFloyd, Belarus, FreeBelarus, StandWithBelarus, Solidarity, Bundestag, Gleichberechtigung, Frauentag, YesSheCan, Empowerment, Weltfrauentag, Türkei, waswirklichzählt, Kommunalwahl, bildung, fdp, wetterau, kommunalwahl, waswirklichzählt, badnauheim, fdp, Kommunalwahl, wetterau, waswirklichzählt, MPK, Pandemie, Öffnungsperspektive, Stufenplan, lockdown, Corona, Myanmar, Myanmar, JusticeForMyanmar, Öffnungsstrategie, Freiheit, Grundrechte, Parlament, Merkel, Regierungserklärung, MPK, ",0.17020833333333332,0.75
35,@muellerboehm,Roman Müller-Böhm,2014-03-01 14:20:15,"Mitglied des Deutschen Bundestages, Obmann der FDP Fraktion im Rechts,- und Tourismusausschuss im Deutschen Bundestag

https://t.co/JjXtKcatkN",2373251115,1297,276,205,https://pbs.twimg.com/profile_images/1040196916120834048/cX4JkzJt.jpg,fdp,0.8,0.05,0.05329886237075165,"Öffnungsstrategie, Freiheit, Grundrechte, Parlament, Merkel, Regierungserklärung, MPK, Bundeskanzlerin, MegaLockdown, MegaLockdown, Roettgen, NRW, Merkel, Bundestag, Lockdown2, Lockdown, CoronaRegeln, AlarmstufeRot, WellenbrecherShutdown, Corona, LockdownLight, Hamburg, Warburg, BrandenburgGate, EU2020DE, DigitaltagFDPBT, Ratspräsidentschaft, Wasserstoffunion, regierungserklärung, Berlin, Mietendeckel, CoronaPandemie, Mittelalter, Digitalisierung, bundestag, regierungserklärung, bundestag, CoronaPandemie, Mittelstand, Coronakrise, Bundestag, NSU, Hanau, Bundestag, Bundestag, covid_19, ",-0.059583333333333335,0.1499999999999999
36,@ruppert_stefan,Stefan Ruppert,2014-07-14 16:38:49,Mitglied des Bundestages | Parlamentarischer Geschäftsführer der FDP-Bundestagsfraktion | Landesvorsitzender der FDP Hessen,2710786593,1957,0,236,https://pbs.twimg.com/profile_images/605300157509435392/EUuaIlNF.jpg,fdp,0.25,0.2,0.041161047508444897,"Gesetzentwurfs, Staatsleistungen, Bundespressekonferenz, Kirchen, Religionspolitik, Thüringen, AFD, Bundestag, WeRemember, wahlrecht, Berlin, Sozialismus, ISIS, Islamkolleg, Imamen, Türkei, Hallams, ExtinctionRebellion, Wahlrechtsreform, ",0.15300000000000002,0.55
37,@michael_g_link,Michael Georg Link,2015-02-13 06:54:35,"Mitglied des Deutschen Bundestages; Sprecher für Europapolitik @fdpbt, Staatsminister a.D.; @osce_odihr Direktor a.D.",3034092143,1953,432,583,https://pbs.twimg.com/profile_images/1082255445207719938/LnPxRZd0.jpg,fdp,0.6,0.0,0.3750774850112334,"Biden, Impfstoff, Impfdesaster, OSZE, Nemzow, Kanzlerin, Öffnungsschritte, Orbán, Ungarn, EU, EU, Impfstoffbeschaffung, vonderLeyen, Aktienrente, RedHandDay, Kindersoldaten, Ausgangssperre, BaWü, Nawalny, Europapolitik, Exportverbot, EU, Belarus, Wahlrechtsreform, Normenkontrollklage, Einreiseperren, EU, Grenzen, Holocaust, WeRemember, HolocaustRemembranceDay, Schuldenbremse, Bundestag, AktuelleStunde, schwarzeschulden, NordStream2, Grenzschließungen, EU, OSCE, ElectoralReform, ",0.06081249999999999,0.4
