,name_id,name,created_at,desc,u_id,num_followers,num_following,num_tweets,img,partei,retweet_rate,replie_rate,ts_perday,hashtags,avg_sent,tweet_rate
374,@JuttaKrellmann,Jutta Krellmann,2012-06-06 11:44:56,"MdB, Sprecherin für Arbeit und Mitbestimmung der @linksfraktion",600984834,3028,1097,2844,https://pbs.twimg.com/profile_images/904966449705472001/E11OylUI.jpg,linke,0.6,0.0,0.4150280539789449,"Niedersachsen, DieLinke, Schlachthof, Cloppenburg, Corona, Textil, Corona, Gewerkschaften, Hanau, HanauIstUeberall, Gesundheit, Pflege, Stress, Arbeitsschutz, Tönnies, HomeOffice, Infektionsschutz, Corona, Gesundheitsschutz, Arbeitsschutz, CovidatWork, antifa, Vermögensungleichheit, LINKEN, digital, Wahljahr21, WeRemember, HolocaustGedenktag, HolocaustRemembranceDay, Holocaust, Esther, Bejarano, Corona, ",0.043541666666666666,0.4
375,@HaraldWeinberg,Harald Weinberg ,2012-07-03 15:24:05,MdB bei @linksfraktion I Kreisvorsitzender in Nürnberg/Fürth I Mitglied im Landesvorstand Bayern,625642009,847,318,473,https://pbs.twimg.com/profile_images/3243210191/90b509be4ae7e6d3ddee42b9849c4dab.jpeg,linke,0.35,0.0,0.006827380106674911,"Mollath, Systemversagen, Euro, Krise, Schäuble, gesundheit, Zypern, Euro, Nürnberg, NSU, Bayern, Gesundheits, CDUCSUFDP, SPD, Kliniken, Gesundheitsversorgung, öffentlichesGut, Rezepte, Pflege, MindestPersonalBemessung, Fallpauschalen, Krise, Gesundheitswesens, Griechenland, Krise, Linken, EuroKrise, NBG, NBG, Faschismus, Verbrechen, Griechenland, armesEuropa, BT, Krankenhauspflege, DerDruckMussRaus, Mollath, Griechenland, EuroKrise, linksfraktion, Griechenland, EuroKrise, RiseUp, Frauen, Griechenland, armesEuropa, ",0.015000000000000003,0.65
376,@MWBirkwald,Matthias W. Birkwald,2012-08-10 07:32:05,"Mitglied des Deutschen Bundestages für @dieLinke, rentenpolitischer Sprecher und parlamentarischer Geschäftsführer der @Linksfraktion, Abgeordneter aus #Köln.",748851762,4779,1710,3693,https://pbs.twimg.com/profile_images/1051040821930278912/RWhSwh2J.jpg,linke,0.55,0.2,0.6190487718835284,"Aktienrente, LINKE, Rente, Selbstbestimmung, InternationalerFrauentag, 8Maerz, Renten, Doppelbesteuerung, Schiewerling, Lobbyistenregister, Hanau, Wilsberg, Diskriminierung, EU, Jobcenter, RedHandDay, Bundestag, Köllealaaf, Altersarmut, Rente, Mindestkurzarbeitergeld, Mindestkurzarbeitergeld, ",0.15013888888888888,0.25
377,@b_riexinger,Bernd Riexinger,2012-09-27 10:16:15,Mitglied des Bundestages für den Wahlkreis Stuttgart. 2012 bis 2021 Parteivorsitzender DIE LINKE. Gewerkschafter. Für einen LINKEN Green New Deal.,849012308,39744,468,6137,https://pbs.twimg.com/profile_images/1366382730724966407/ZudNOj1q.jpg,linke,0.1,0.1,2.16378754657474,"ltwbw21, Stuttgart, Krawallnacht, Mob, Dresden, dd1303, ltwbw21, linksBWegt, Ehrenerklaerung, Ehre, Schande, CDUKorruption, Klimaliste, Stuttgart, Klimagerechtigkeit, Klima, Bareiß, Baku, Korruption, CDU, Bareiß, Aserbaidschan, Bareiss, Finnland, Kapitalismus, Impfpatente, linksBWegt, BestesVideo, Bundesregierung, Coronahilfen, linksBWegt, Lula, Brasilien, Pflegekräfte, Pflege, PflegenotstandStoppen, Nuesslein, Loebel, Spahn, Liste, CDU, CSU, Maskendeals, Union, Loebel, Nuesslein, CDU, CSU, Korruption, Weltfrauentag, Frauen, Feminizide, Union, Korruption, CDU, CSU, Bundestag, Merkel, Laschet, Söder, Maskenskandal, NieMehrCDUCSU, Bundesregierung, Aldi, Spahn, Schnelltest, Impfstoff, Löbel, Korruption, CDU, CSU, Spahn, Maskendeals, Verfassungsschutz, Rassismus, Rechtsextremismus, Antisemitismus, Haldenwang, FCKAfD, ",0.015208333333333329,0.8
378,@SylviaGabelmann,"Sylvia Gabelmann, MdB",2012-09-28 12:42:17,"Abgeordnete für DIE LINKE aus NRW im deutschen Bundestag. Schwerpunktthemen: Gesundheit, Umwelt, Frauen, Frieden.",850993608,1781,1367,776,https://pbs.twimg.com/profile_images/934446425911545861/txDojbRK.jpg,linke,0.2,0.0,0.3758418198218671,"Wahl, Landtagswahl, Kommunalwahl, ltwbw21, ltwrlp21, EqualPayDay, Lohngerechtigkeit, Frauen, Gleichstellung, Gerechtigkeit, Solidarität, Frauentag, Frauenkampftag, InternationalWomensDay, COPSYStudie, Ungleichheit, Coronakrise, Versandhandel, Arzneimittelsicherheit, Bundesregierung, Patienten, Gesundheit, SolidaritätmitRomana, Europa, Bürgerinitiative, Corona, Impfstoff, Radikaleneralss, WeRemember, Faschismus, Antisemitismus, Rassismus, Covid19, Pandemie, Gerechtigkeit, Impfstoff, Nationalismus, istanbulkonvention, iknachgefragt, GewaltgegenFrauenstoppen, Atomwaffenverbotsvertrag, Aufrüstung, Atomwaffen, Masken, Impfstoffen, Cannabis, Polizei, LegalizeIt, Atomwaffen, Aufrüstung, Kriegstreiberei, UNAtomwaffenvertrag, Antifaschismus, Niedersachsen, WirsindalleAntifa, Impfstoff, Curevac, Volksinitiative, Krankenhäuser, NRW, Gesundheit, Menschenrecht, ",0.08870833333333332,0.8
379,@NicoleGohlke,Nicole Gohlke,2012-10-07 14:33:37,"MdB #Linke | Sprecherin #Hochschule #Wissenschaft | #Bayern | #München | twittert zu #Mietenwahnsinn, #Bildung, Klassenpolitik & sozialen Bewegungen",866425075,7923,912,5726,https://pbs.twimg.com/profile_images/1329781576545210370/OKNseI4G.jpg,linke,0.3,0.05,2.7586509418035465,"online, Ehrenerklaerung, lobbyunion, maskenaffaere, servicetweet, Schäuble, CDU, Lobbyunion, CDUkorrupt, Regelstudienzeit, Hochschulen, Langzeitstudiengebühren, Prüfungen, THgegenCorona, Coronacampus, NeueRechte, DieWelt, Wissenschaftsfreiheit, TeamStrobl, Aserbaidschan, Wahlkreis, Shisha, Strenz, Lintner, Fischer, Hauptmann, Lobbyunion, Clankriminalität, Korruption, Lobbyunion, CSU, Bayern, Seehofer, Söder, Lobbyregister, Coronakrise, BMBF, BAföG, Corona, Studium, Kurzarbeitergeld, Mindestlohn, HartzIV, Coronakrise, Corona, Armutsbericht, DeutschePost, DHL, Coronakrise, Corona, Post, EqualPayDay, Kita, Pflege, Handel, Entgelttransparenzgesetz, GenderPayGap, Coronakrise, Bildungskrise, Bayern, Piazolo, Karliczek, Union, CDU, CSU, Lobbyregister, Bundestag, Bundesregierung, Fischer, Löbel, Nüßlein, Amthor, Söder, Coronakrise, NoCovidMonopolies, Ziemiak, Amthor, CDU, cdukorrupt, CDUrausausderRegierung, lobbyunion, ",-0.04054166666666668,0.65
380,@GregorGysi,Gregor Gysi,2012-10-18 07:20:12,"Mitglied des Bundestages, direkt gewählt in Berlin Treptow-Köpenick, Außenpolitischer Sprecher der @linksfraktion https://t.co/r0C9ip9fFP",888289790,403560,147,2357,https://pbs.twimg.com/profile_images/929295299889246210/7TLmTIpi.jpg,linke,0.25,0.25,0.46054806770916235,"btw21, Lula, Lula, frauentag2021, Weltfrauentag, IWD2021, frauentag2021, Weltfrauentag, IWD2021, zweistellig, Russland, Europa, Bundesregierung, Schwesig, NordStream2, Sanktionen, Frankreich, Diplomatie, Politik, Tagesgespräch, Jahresauftakt, ",0.08374999999999999,0.5
381,@berlinliebich,Stefan Liebich,2013-01-06 14:57:49,"DIE LINKE | MdB | Finanzausschuss | USA | VR China | 2009, 2013, 2017 für Pankow, Prenzlauer Berg & Weißensee direkt gewählt | Tweets von Stefan+Team",1065899292,25511,7755,15260,https://pbs.twimg.com/profile_images/1230409378509074432/ITWAGX-U.jpg,linke,0.0,0.5,14.596865166436189,"BadenWuerttemberg, RheinlandPfalz, linksbwegt, NazisRaus, dd1303, LinkeLVV, LinkeLVV, ",0.077,0.5
382,@AlexanderSNeu,"Alexander S. Neu, MdB",2013-02-15 14:53:02,"Obmann im Verteidigungsausschuss & Osteuropa-Beauftragter für die Fraktion DIE LINKE, Schwerpunkt Friedens- sowie Außen- und Sicherheitspolitik",1182878557,5498,496,5738,https://pbs.twimg.com/profile_images/640262109901791232/JkmYH49E.jpg,linke,0.35,0.15,0.8227871088099462,"Sanktionen, Krieg, Auschwitz, MAD, Bundeswehr, Deutschland, Rechtsextremismus, dielinke, dielinkenrw, nawalny, ai, Russland, Deutschland, Bundeswehr, moria, dielinke, dielinke, dielinkenrw, Bundeswehr, Irak, Deutschland, NATO, Syrien, Russland, China, USA, Auschwitz, Auschwitz, Serbien, Westen, Slowenien, Kroatien, Makedonien, Montenegro, BiH, Deutschland, Russland, China, Corona, Covid19, ",-0.020416666666666663,0.5
383,@KirstenTackmann,Kirsten Tackmann,2013-03-24 10:47:35,"geboren in THÜ, aufgewachsen in B; wohne seit 1987 in einem 60-Seelendorf; Dr. med. vet.,
seit 2005 MdB für DIE LINKE, Agrarpolitikerin, verheiratet, 2 Kinder",1294725486,3622,1381,10262,https://pbs.twimg.com/profile_images/465421686758576129/GMsAfC6n.jpeg,linke,0.9,0.05,15.573045442140328,"dd1303, Corona, Berlin, Potsdam, muc1303, m1303, München, munich, Rheinlandpfalz, BadenWürttemberg, Hessen, ltwbw21, ltwrlp21, DD1303, Dresden, dd1303, Sachsen, muc1303, muc1303, Dresden, dd1303, BTW21, linkelvv, aufbruch, btw21, linkelvv, linkelvv, Cannabis, CBD, Polizei, Homeschooling, Corona, Dresden, ",0.07758333333333334,0.04999999999999993
384,@joerg_cezanne,Joerg Cezanne,2013-04-30 12:00:22,"Bundestagsabgeordneter DIE LINKE, Finanzen und Verkehr",1391879604,659,34,145,https://pbs.twimg.com/profile_images/1054001842663907328/IpwvxPMB.jpg,linke,0.4,0.0,0.17520894526567676,"Spahn, Korruptionsskandale, Union, Lobbyregister, TRME21, HanauIstÜberall, Scheuer, ScheuerRücktritt, ScheuerEntlassung, Maut, Scheuer, mautdebakel, DanniBleibt, KeineA49, DannenroederForst, dannibleibt, keineA49, DannenroederForst, dannibleibt, keineA49, Femizid, saveXX, keinemehr, schweigenbrechen, Nov25, Gemeinnützigbraucht, VVNBdA, Gemeinnützigbraucht, Gemeinnützigbraucht, DannenroederForst, Klimakrise, danni, ",-0.029958333333333337,0.6
385,@NordMdb,Thomas Nord,2013-05-11 21:07:13,Die Linke,1421571306,3888,841,4555,https://pbs.twimg.com/profile_images/3646240076/60bbd856eab9846c9a0be5b64babde02.jpeg,linke,0.8,0.2,4.034815504403844,"Auschwitz, Auschwitz, Auschwitz, Berlin, Berlin, Kältehilfe, Auschwitz, Tagesspiegel, Auschwitz, Brandenburg, Corona, fachkraftmangel, ",0.05697916666666667,0.0
386,@michel_brandt_,Michel Brandt,2013-06-24 14:54:02,Mitglied des deutschen Bundestags (MdB) - DIE #LINKE - Wahlkreis #Karlsruhe - Konsequent für eine soziale und solidarische Gesellschaft,1543429536,4142,475,4149,https://pbs.twimg.com/profile_images/667006541682331648/2UTgtMw-.jpg,linke,0.5,0.0,3.2123282599160246,"Abschiebekönig, Kretschmann, BW, Wahl, Landtagswahl, Kommunalwahl, ltwbw21, ltwrlp21, Abschiebung, Kosovo, CDU, Corona, Ehrenerklaerung, ltwbw2021, SWR, dwenteignen, Mietendeckel, Mietenwahnsinn, Hauptmann, CDU, Aserbaidschan, NieMehrCDU, Fukushima10, AKW, DontNukeTheClimate, Atomkraft, AKW, Neckarwestheim, Fukushima, BadenWürttemberg, CDUrausausderRegierung, Landtagswahl, ltwbw, ltwbw21, Kretschmann, NieMehrCDUCSU, NieMehrCDU, KorruptionAbwaehlen, Maskenskandal, Maskendeal, linksBWegt, Grüne, Lieferkettengesetz, Lesbos, Moria, Hanau, KeinEinzelfall, Afghanistan, Corona, StopDeportation, Polizeigewahrsam, Polizeiproblem, BW, dieLinke, ltwbw, Amthor, niemalsCDU, Lobbyregister, Verhaltenskodex, maskenaffaere, Moria, KaraTepe, Frauentag, Rassismus, Antisemitismus, Neonazismus, Sexismus, AfD, ",-0.05437500000000001,0.5
387,@DietmarBartsch,Dietmar Bartsch,2014-01-31 09:25:36,"Mitglied des Bundestages, Vorsitzender der @Linksfraktion, https://t.co/rAa7VVbhNb",2320519958,66950,198,6097,https://pbs.twimg.com/profile_images/1279003636341899264/Hv3UeIcG.jpg,linke,0.25,0.0,3.677567259885061,"Bürgerversicherung, zweistellig, MV, CDU, btw21, Kindergrundsicherung, Armut, Kindheit, Freitagumeins, zweistellig, Loebel, Nuesslein, Hauptmann, Fukushima, aufbruch, GenderPayGap, EqualPayDay, Altersarmut, Rente, Mindestlohn, Armutslohn, ",0.1313988095238095,0.75
388,@ZaklinNastic,"Żaklin Nastic, MdB",2014-05-04 10:37:53,"Bundestagsabgeordnete @linksfraktion, menschenrechtspolitische Sprecherin, Landessprecherin @dielinke_HH ⚓️ und vor allem Mensch 
#menschenrechte",2527808433,4348,866,3476,https://pbs.twimg.com/profile_images/1356297732252696576/u_WcD-8y.jpg,linke,0.2,0.15,1.5388601627909584,"Bundestagswahl, BTW21, WelttagGegenInternetzensur, Internetzensur, China, Digitalkonzerne, Arbeitslosenzahlen, Hamburg, Armutsbekämpfung, Gesundheitsversorgung, CDU, Union, Lobbyregister, EqualPayDay, Frauen, Frauenkampftag, Hamburg, EU, Puigdemont, Frauentag, Frauen, Systemwechsel, Frau, Luxemburg, Menschenrechte, Rosa150, Menschenrecht, sozialeSicherheit, Pandemie, Menschenrechtsbericht, US, UN, Assange, COVID19, Mumia, FreeMumia, Hamburg, Hasél, Kunstfreiheit, Habeck, Arbeitskampf, ZeroDiscriminationDay, Frauen, Mädchen, Lieferkettengesetz, Frauenrechte, ",-0.06875,0.65
389,@Conni_Moehring,Cornelia Möhring,2014-06-30 11:04:13,Feministin -  Fraktionsvize LINKE im Bundestag - Frauenpolitische Sprecherin - #PACER #reproduktiveGerechtigkeit  #Solidarität #sexuelleSelbstbestimmung,2596171296,4731,1584,5814,https://pbs.twimg.com/profile_images/1167699984655011840/SQ5cm-ff.jpg,linke,0.6,0.1,3.3316797446913795,"DD1303, LongCovid, Aufbruch, CDUrausausderRegierung, RKI, COVID, reproduktivenGerechtigkeit, NieMehrCDU, reproduktiveGerechtigkeit, TeamStrobl, TeamStrobl, EqualPayDay, Lohngerechtigkeit, Pflegearbeit, Tarifbindung, Parität, esreicht, Frauenkampftag, ProChoice, wegmit218, wegmit219a, abortionishealthcare, meinabbruch, FeministischerKampftag, ",0.07691666666666666,0.30000000000000004
390,@UllaJelpke,"Ulla Jelpke, MdB",2014-10-20 09:49:39,innenpolitische Sprecherin der @linksfraktion im Deutschen Bundestag.,2837971145,13657,218,2146,https://pbs.twimg.com/profile_images/524143487004844032/H7vuDeUP.jpeg,linke,0.1,0.3,1.09166339330758,"Familiennachzug, Familiennachzug, Afghanistan, AfganistanIsNotSafe, BAMF, Bundestagswahl, Abschiebung, Sinti, Roma, Antiziganismus, Bleiberecht, Abschiebung, Lufthansa, FDJ, LLDemo, Rassismus, rechtsextreme, Flüchtlinge, neofaschistischer, SeaWatch3, Anker, noanker, ",-0.031249999999999993,0.6
391,@victorperli,Victor Perli,2015-06-29 13:33:18,Bundestagsabgeordneter @DieLinke. Kontrolliert den Haushalt der Bundesregierung. Hat Scheuer angezeigt und fordert Seehofers Rücktritt. Insta: bundestagsperli,3350681139,6010,1792,2441,https://pbs.twimg.com/profile_images/1345333417869799429/Df3qFohA.jpg,linke,0.4,0.15,3.649421444878526,"Mindestlohnbetrug, Mindestlohn, Mindestlohnbetrug, Mindestlohn, Ehrenerklärung, CDU, Ehrenerklärung, DieLinke, CDU, Ehrenerklärung, DieLinke, Mindestlohn, Mindestlohnbetrug, CDUabwählen, Mindestlohnbetrug, Mindestlohn, Mindestlohn, Meldeportal, Mindestlohn, Niedersachsen, Mindestlohn, mindestlohnbetrug, Mindestlohnbetrug, Mindestlohn, Mindestlohnbetrug, Mindestlohn, Mindestlohn, Mindestlohnbetrug, Mindestlohnbetrug, Mindestlohn, Mindestlohnbetrug, Mindestlohn, Mindestlohn, Mindestlohnbetrug, Mindestlohn, Scholz, Mindestlohnbetrug, ",-0.05520833333333334,0.44999999999999996
392,@thlutze,Thomas Lutze,2015-09-15 19:41:47,,3667108397,329,2,306,https://pbs.twimg.com/profile_images/643875127248162816/rUMHUQG3.png,linke,0.0,0.0,0.025804687770819238,,0.005750000000000003,1.0
393,@jankortemdb,Jan Korte,2015-11-11 15:38:47,"Hier twittern Jan Korte, 1. Parlamentarischer Geschäftsführer @Linksfraktion, und sein Team.",4164673821,26723,416,2134,https://pbs.twimg.com/profile_images/1324392598203736065/6etttyVB.jpg,linke,0.4,0.05,2.2135567560029203,"noAfD, ltlsa, dielinke, Kretschmann, ltwbw21, LTWRP21, CDU, Lobbytätigkeit, BTW2021, Maskenskandal, Vermögensabgabe, GroKo, Linksfraktion, Lobbyisten, maskenaffäre, Weltfrauentag, CDUrausausderRegierung, MaskenGate, Lobbyismus, Flick, Parteispendenaffäre, Amthor, Lobbyismus, CDU, CSU, Korruption, Korruption, ",0.0695,0.55
394,@Norbert_MdB,Norbert Müller,2015-11-24 15:29:07,"Bundestagsabgeordneter für @DieLinkeBrdburg -
sozialistisch - links - demokratisch - antifaschistisch",4265444913,2489,1127,4355,https://pbs.twimg.com/profile_images/1366087486859001861/aWSLxN-5.jpg,linke,0.5,0.2,1.4205557935931705,"Staudenhof, Potsdam, Wieler, Spahn, Bundesregierung, Maskengate, CDUKorruption, Mindestlohn, Mindestlohnbetrug, DeutscheWohnen, Vonovia, CDU, Maskenskandal, CDUrausausderRegierung, NieMehrCDU, Eisschnelllauf, Berlin, Garnisonkirche, Scholz, Bundesregierung, Impfdesaster, AfD, Marrokko, Bundesregierung, Spahn, Polizeigesetz, Grüne, CDU, FDP, noafd, LINKEBPT, SpringerhaltsMaul, ",-0.04724999999999999,0.30000000000000004
395,@SusanneFerschl,"Susanne Ferschl, MdB",2019-02-14 15:06:42,"MdB DIE LINKE l Stellvertretende Fraktionsvorsitzende I verantwortlich für Arbeit, Soziales und Gesundheit I @linksfraktion I twittert selbst",1096063189249331201,1213,519,1596,https://pbs.twimg.com/profile_images/1096067570753523713/AXkwaKiY.jpg,linke,0.25,0.25,1.9893383524625718,"Transparenzoffensive, Ehrenerklaerung, Union, Lobbyregister, Amthor, Scheuer, Corona, Leiharbeit, Niedriglohn, Lohn, Arbeit, Leiharbeit, Bundesregierung, Sozialstaat, Datenreport2021, Datenreport2021, Emanzipation, EqualPayDay, Bayern, Arbeit, Entgelttransparenzgesetz, Bundesregierung, Mindestlohn, Union, Mindestlohn, Lobbyregister, Frauenkampftag, GenderPayGap, Selbstbestimmung, Weltfrauentag, CDU, CSU, Amthor, Union, Lobbyregister, Pandemie, Parlament, Dividenden, Konzerne, Kurzarbeit, Steuergeld, ",0.007500000000000004,0.5
396,@jessica_tatti,Jessica Tatti,2018-07-20 13:19:16,Für DIE LINKE im Bundestag,1020297087970435072,489,95,28,https://pbs.twimg.com/profile_images/1020298778874646528/ZG2g6dso.jpg,linke,0.4,0.3,0.02637677664823969,"Hanau, hanauwarkeineinzelfall, 19februar, keinvergebenkeinvergessen, RedHandDay, ltwbw21, linksBWegt, ltw21, ltw, ltwbw21, ltw, ltwbw21, linksBWegt, ulm, Gesundheit, linksBWegt, ltw, linksBWegt, linksBWegt, Algorithmen, Diskriminierung, Fortschrittsgedanken, freelancer, absicherung, gutearbeit, linke, HartzIV, FridaysForFuture, Berlin, KuenstlicheIntelligenz, ",0.08533333333333332,0.30000000000000004
397,@FrStraetmanns,"Friedrich Straetmanns, MdB",2018-02-01 13:44:45,Mitglied des Bundestages | Justiziar und rechtspolitischer Sprecher der @Linksfraktion | DIE LINKE Bielefeld,959059951523106816,1858,786,2470,https://pbs.twimg.com/profile_images/1280515989747249154/DIdFtVGr.jpg,linke,0.4,0.2,5.0714207656093375,"CDU, CSU, Korruption, Lobbyregister, Nüßlein, Loebel, Hartmann, NieMehrCDUCSU, Ehrenerklaerung, CDUKorruption, FrStraetmanns, Union, Korruptionsaffaere, Korruption, Maskenskandal, Aserbaidschan, Union, Bareiß, CDUKorruption, CDU, Union, CDU, CSU, Korruption, Bundestag, Bundesregierung, Spahn, CDU, CSU, NieMehrCDUCSU, CDUrausausderRegierung, Maskenaffäre, Korruption, Maskenskandal, Korruption, CDU, CSU, Masken, Aserbaidschan, Baku, Baku, Dobrindt, Abgasskandal, Maskenskandal, Union, maskenaffaere, Coronakrise, Pandemie, Bundesregierung, Migrationshintergrund, Corona, EqualPayDay, Alleinerziehende, Corona, Lockdown, Corona, Bundesregierung, ",0.03941666666666667,0.3999999999999999
398,@MdB_Schreiber,Eva-Maria Schreiber,2017-12-12 14:13:39,"Bundestagsabgeordnete (DIE LINKE.) 
@linksfraktion Mitglied im Landesvorstand Bayern #Fluchtursachen #Migration #Welternährung #Frieden #Menschenrechte",940585440746328064,1399,1064,1042,https://pbs.twimg.com/profile_images/1343893477189365761/P3ESxGE-.jpg,linke,0.0,0.25,1.3018056103104416,"BadenWürttemberg, RheinlandPfalz, Hessen, linksBWegt, ltwbw, ltwrlp21, LTW21, badenwürttemberg, linksBWegt, ltwbw, Finnland, Corona, Impfstoff, Kapitalismus, Fukushima, tschernobyl, Atomkraft, Abschalten, Fukushima, Büfa, EON, Bayernwerk, regensburg, Deutschland, Digitalisierung, cdukorrupt, CDUrausausderRegierung, Entgelttransparenzgesetz, Lohndiskriminierung, epd2021, Verunsicherung, Corona, Pandemie, RotenSofa, Weltfrauentag, weltfrauentag2021, Frauenrechte, Frauenschutz, 8marchwomensday, RosaLuxemburg, Pazifismus, rosa150, RosaLux150, rslxmbrg, Frauenrechte, Frauenschutz, Pandemie, Regensburg, Bayern, Lieferkettengesetz, Bundesregierung, DIELINKE, Regensburg, Veitshöchheim, Bundestagswahl, CDUrausausderRegierung, CSU, Lieferkettengesetz, Lobbyregister, Wirtschaft, Politik, RotesSofa, Wahlkampf, LinkeBPT, Bundestagswahl, bundestagswahl2021, machtdaslandgerecht, Aufbruch, ",0.033333333333333326,0.75
399,@Amira_M_Ali,Amira Mohamed Ali,2017-11-24 12:01:36,"Mitglied des Bundestages | Vorsitzende der @Linksfraktion
https://t.co/R8w0c33WAh",934029228886065152,7148,292,808,https://pbs.twimg.com/profile_images/1120042822911049728/RgoNnku_.jpg,linke,0.45,0.0,1.0888130126719484,"Niedersachsen, DieLinke, Wahltag, CDUKorruption, CDU, Dax, Bundesregierung, hartaberfair, osrat, CDU, ltlsa, Frauentag, dielinke, Landtour, Sangerhausen, Frauenhaus, IstanbulKonvention, phoenixunter3, Weltfrauentag, Laschet, löbel, Frauenkampftag, InternationalWomensDay, hartaberfair, Scheuer, Spahn, Taskforce, Realsatire, linke, aufbruch, linkeimbundestag, Bundeswehr, Bundestag, Afghanistan, Lockdown, Bundesregierung, Amthor, Nüßlein, CDU, CSU, Lobbyregister, Bundesregierung, Spahn, Schnelltests, Bundesregierung, Impfstoff, FDP, Bundestag, ",-0.011458333333333334,0.55
400,@MdB_Freihold,MdB Brigitte Freihold,2017-11-01 12:39:45,Mitglied des Bundestags für #DieLinke aus Pirmasens.,925703909825548288,855,232,898,https://pbs.twimg.com/profile_images/1066952177837580290/cI9iFZ4g.jpg,linke,0.65,0.05,1.2421033524125114,"corona, Fluglärm, Verteidigungsministerium, Deutschland, Fotowettbewerbs, live, EqualCareDay, EqualPayDay, Pandemie, EqualPayDay, EqualPayDay, Lohngerechtigkeit, Pflegearbeit, Tarifbindung, Kulturbereich, Frauen, frauentag2021, Frauentag, GenderPayGap, Selbstbestimmung, InternationalerFrauentag, Frauenkampftag, Gleichberechtigung, EqualPay, Parität, Pandemie, Frauen, RosaLuxemburg, rslxmbrg, Brandenburg, Klimaversprechen, Arbeitslosigkeit, Pirmasens, Südwestpfalz, Zweibrücken, Unrecht, Kolonialismus, ",-0.05166666666666666,0.29999999999999993
401,@AchimKesslerMdB,"Dr. Achim Kessler, MdB",2017-04-05 10:20:10,Frankfurter MdB | hessenweit unterwegs | Sprecher für Gesundheitspolitik | Bundestag | Ausschuss Gesundheit | Obmann | DIE LINKE,849567328899616768,2663,580,3001,https://pbs.twimg.com/profile_images/1092838720418598912/hN6ILpt2.jpg,linke,0.2,0.0,4.717756218678082,"Frankfurt, Kommunalwahl, Coronakrise, AfD, noAfD, Landtagswahl, BaWü, sogehtsolidarisch, hessensozial, kommunalwahl, kommunalwahl2021, hessen, frankfurt, DIELINKEHessen, DIELINKEFrankfurtMain, Impfstoff, Biontech, Lizenzen, Pandemie, ltwrlp21, gießen, hessen, Coronavirus, Pandemie, Veranstaltungshinweis, Gesundheitssystem, CoronaKrise, sogehtsolidarisch, hessensozial, wohnen, wohnraum, frankfurt, Paradieshof, Frankfurt, sogehtsolidarisch, Spahn, Scholz, ",0.11625,0.8
402,@AkbulutGokay,Gökay Akbulut MdB,2016-11-20 21:55:35,MdB @Linksfraktion im Bundestag | Migrations- & Integrationspolitische Sprecherin | Federal Parl. Milletvekili | #LeaveNoOneBehind | es twittern Gökay & Team,800457587510476800,3854,1626,3239,https://pbs.twimg.com/profile_images/1347927096459468801/6_yP5Kf8.jpg,linke,0.4,0.0,3.1008196022001817,"DieLinke, linksBWegt, Solidarität, Fallpauschalen, Pflege, LTW21, Gesundheit, linksBWegt, DieLINKEinDenLandtag, Esslingen, LINKEindenLandtag, linksBWegt, ltwbw, TeamStrobl, Lesbos, PushBack, LeaveNoOneBehind, EqualPayDay, linke, ltwbw21, EqualCareDay, EqualPayDay, EqualPayDay, EqualPayDay, GenderPayGap, epd2021, keinvergessen, Integrationsgipfel, Integrationsgipfel, Loebel, Nuesslein, CDU, CSU, Korruption, ichbleibe, Weltfrauentag, maskengate, InternationalWomensDay, linksBWegt, LinkeindenLandtag, InternationalerFrauentag, linksBWegt, ",0.12920833333333334,0.6
403,@DorisAchelwilm,Doris Achelwilm,2016-01-16 22:40:34,"▪️Bremer Bundestagsabgeordnete, Fraktion DIE LINKE
▪️Sprecherin für Gleichstellungs-, Queer- und Medienpolitik",4819478705,2860,1246,4231,https://pbs.twimg.com/profile_images/1247991574673248256/kjgvSKHY.jpg,linke,0.55,0.05,4.746232678358825,"BaWü, RheinlandPfalz, Hessen, Wahltag, ltwbw21, ltwrlp21, Ehrenerklaerung, CDUKorruption, Maskengate, HDP, Türkei, Enteignungen, CDU, Union, Residenz, Bremen, Pflege, Coronavirus, Pandemie, Impfstoff, capitalismkills, patentskill, TeamStrobl, Datenreport, Corona, Bundestag, CDUrausausderRegierung, EqualPayDay, GenderPayGap, Gleichstellung, EqualPayDay, ",0.06608333333333333,0.3999999999999999
404,@ZdebelHubertus,"Hubertus Zdebel, MdB",2015-12-21 14:30:15,"Fraktion DIE LINKE. im Bundestag, Sprecher für den #Atomausstieg, Weitere Arbeitsbereiche: #Hambibleibt #Kohleausstieg #NRW #NoFracking;",4557858142,1671,517,1324,https://pbs.twimg.com/profile_images/1042503566940889089/CFukEwPK.jpg,linke,0.4,0.0,0.5377143030155032,"NoMoreEmptyPromises, AnotherWorldIsPossible, antiatom, Fukushima, NaturFreunde, EqualPayDay, Maskenaffäre, Atomenergie, Harrisburg, Tschernobyl, Fukushima, Atomausstieg, CDU, Lobbyregister, weltfrauentag, feministischerKampftag, antiatom, NaturFreunde, RosaLuxemburg, DieLinke, Verfassungsschutz, AfD, Tarifrunde, Daimler, IGMetall, TRME21, UN, Klimawandel, Springer, RAF, JellaHaase, WELT, Vergesellschaftung, BillGates, Atomkraft, Klimaschutz, Union, SPD, Lieferkettengesetz, systemchange, Bundesregierung, Scholz, LNG, RWE, Kohleausstieg, Energiecharta, Bundesregierung, URENCO, atomwaffen, ",0.08843055555555555,0.6
405,@smuellermdb,Stefan Müller,2008-12-08 11:34:51,MdB für Erlangen und Erlangen-Höchstadt. Parlamentarischer Geschäftsführer der @csu_bt.,17960911,8511,310,2079,https://pbs.twimg.com/profile_images/1304037076149600256/EmNTNNWv.jpg,csu,0.7,0.05,1.042380058442092,"Verfassungsschutz, Clubhouse, Wissler, spendeblutretteleben, Blutspende, OERR, Linnemann, Steuererhöhungen, Habeck, R2G, WirGegenExtremismus, Bundeswehr, SocialMediaDivision, WirBeziehenStellung, Soldatinnen, Soldaten, WirGegenExtremismus, StandhaftGegenExtremismus, ZeigHaltung, BunteBundeswehr, WirSindVielfalt, WirSindBunt, BundeswehrGegenExtremismus, SocialMediaDivision, ",-0.04604166666666666,0.25
406,@VolkerUllrich,Volker Ullrich,2009-04-02 23:25:37,"Mitglied des Deutschen Bundestages, CDU/CSU-Fraktion. Jurist, Diplom-Kaufmann. Wahlkreis Augsburg-Stadt. CSU-Bezirksvorsitzender.",28446356,3861,1259,2368,https://pbs.twimg.com/profile_images/886902152760893440/SZw-NRGL.jpg,csu,0.0,0.15,1.097076072892556,"Myanmar, ",0.10791666666666666,0.85
