,name_id,name,created_at,desc,u_id,num_followers,num_following,num_tweets,img,partei,retweet_rate,replie_rate,ts_perday,hashtags,avg_sent,tweet_rate
141,@RuedigerKruse,Rüdiger Kruse,2009-02-15 15:44:24,Im Bundestag für Hamburg-Eimsbüttel | Berichterstatter für #Kultur #Medien #Kanzleramt im #HHA | Beauftragter für maritime Wirtschaft @cducsubt,20916357,2596,1248,1864,https://pbs.twimg.com/profile_images/1806075514/Ohne_Titel.jpg,cdu,0.05,0.1,0.3120556486433143,"Weltfrauentag, cdu, Allemagne, Corona, Wirtschaft, Coronahilfen, CDU, SPD, cdu, csu, Kindersoldaten, RedHandDay, Kindersoldaten, RedHandDay, Luebcke, cducsu, CDU, Luebcke, Lübcke, StephanE, Kassel, Schuldenbremse, cducsu, cducsu, CDU, DFPV, CDU, DFPG, tagdermigration, migration, cdu, sdg, Nachhaltigkeit, Corona, CDU, cducsu, cdupt21, ctalks, ",0.09724999999999999,0.85
142,@petertauber,Peter Tauber,2009-02-28 14:36:49,"MdB im schönsten Wahlkreis Deutschlands, Christdemokrat, Reserveoffizier, Waidmann, Kickers Offenbach, das Bild ist von @toko. Und privat hier! 🌲🌲🌲🌲",22260144,185536,1573,24797,https://pbs.twimg.com/profile_images/895996599448555522/dZsD6jDs.jpg,cdu,0.25,0.25,2.3873434703714365,"tempusfugit, tempusfugit, tempusfugit, tempusfugit, preussen, Bundeswehr, Isso, Clubhouse, HR, tempusfugit, tempusfugit, maskenskandal, maskengate, loebel, CDU, tempusfugit, ",0.03830952380952381,0.5
143,@JM_Luczak,Dr. Jan-Marco Luczak,2009-03-05 11:25:35,MdB aus Berlin 🏛 | Sprecher der CDU/CSU für Recht und Verbraucherschutz ⚖️ | direkt für Tempelhof-Schöneberg ❤️ | Rechtsanwalt 👨‍⚖️,22908417,5349,571,3873,https://pbs.twimg.com/profile_images/1351479547275960321/qHaUbXKC.jpg,cdu,0.3,0.15,3.0851563540401665,"Enteignung, Giffey, Giffey, Enteignung, Corona, Haustier, Familienmitglied, Löbel, Nüsslein, Abgeordnetenbestechung, Linkskurs, Bonushopper, Wettbewerb, Energiemarkt, Fehlerkultur, Berlinern, Auto, Senatorinnen, Wohnungspolitik, Löbel, Nüsslein, ",0.006458333333333344,0.55
144,@Ingmar_Jung,Ingmar Jung,2009-03-08 10:47:11,Bundestagsabgeordneter für den Wahlkreis Wiesbaden.,23296367,1682,655,724,https://pbs.twimg.com/profile_images/810267130784583682/fruexgTq.jpg,cdu,0.45,0.2,0.04556082220175733,"schoenerschein, Pressefreiheit, Israel, ",0.028124999999999994,0.35
145,@AMattfeldt,AMattfeldt,2009-03-09 15:22:39,Seit 2009 direkt gewählter Bundestagsabgeordneter für den Wahlkreis Osterholz - Verden im Bundesland Niedersachsen.,23447001,384,85,127,https://pbs.twimg.com/profile_images/1232670130070605824/pqxHb0iE.jpg,cdu,0.0,0.0,0.00687648592714066,,-0.029166666666666667,1.0
146,@SteffenBilger,Steffen Bilger,2009-03-12 09:30:05,"MdB Wahlkreis Ludwigsburg, Parlamentarischer Staatssekretär im @BMVI, Vorsitzender CDU Nordwürttemberg",23925041,5172,809,3186,https://pbs.twimg.com/profile_images/563393637300436992/NX_zi6XM.jpeg,cdu,0.25,0.35,0.5243601507751499,"Gäubahn, Eisenmann, Eisenmann, ltwbw21, wirtschaft, TagderMuttersprache, ltwbw21, candycrush, Waiblingen, ",0.24583333333333335,0.4
147,@BerndSiebert,"Bernd Siebert, MdB",2009-03-16 10:39:51,"Bundestagsabgeordneter sowie Bezirksvorsitzender der 
CDU Kurhessen und Waldeck",24674518,1959,864,307,https://pbs.twimg.com/profile_images/339670134/Bild_Siebert_Internet_Twitter.jpg,cdu,0.05,0.0,0.0152085564204059,"Bundeswehr, Podcast, BahnBw, ",0.19033333333333333,0.95
148,@franksteffel,Frank Steffel,2009-03-26 22:18:19,#MdB für #Berlin-#Reinickendorf & Präsident der @fuechseberlin @fuechseberlinev,26869088,2910,448,1599,https://pbs.twimg.com/profile_images/893502776336158722/HM-NiAZe.jpg,cdu,0.15,0.0,0.07786562990926206,"CoronahilfenProfisport, Bund, Sport, bundestag, TXL, COVID19, Neuer, ",0.1023611111111111,0.85
149,@josefoster,Josef Oster,2009-04-01 11:40:24,"Bundestagsabgeordneter, direkt gewählt im Wahlkreis 199 - Koblenz",28089973,623,271,258,https://pbs.twimg.com/profile_images/1346952909058052096/4aAh_szL.jpg,cdu,0.45,0.05,0.01658199604763817,"wirmachendas, tvduell, baldauf21, ltw21, CDU, cdupt21, wegenmorgen, BadEms, MdB, Bürgermeister, DeutscheBahn, cdu, cdupt21, wegenmorgen, wegenmorgen, StandingCorps, WirFrauenGegenMerz, WirMaennergegenBaerbock, StandingCorps, Washington, USA, Demokratie, Amazon, Koblenz, Gymmotion, Bürgermeister, Marmorsaal, Danke, BadEms, ",0.1474166666666667,0.5
150,@VolkmarKlein,Volkmar Klein,2009-04-18 23:02:55,"Mitglied des Deutschen Bundestags, 
Abgeordneter für Siegerland und Wittgenstein",33043294,1701,70,290,https://pbs.twimg.com/profile_images/639893475085942786/sb1qS99b.jpg,cdu,0.1,0.0,0.012930068955057612,,0.012916666666666665,0.9
151,@Erwin_Rueddel,Erwin Rüddel,2009-04-19 00:47:55,CDU-MdB für die Region Rhein-Westerwald-Sieg. Politik - Sport - Gesundheit - Pflege - Brauchtum. Vorsitzender des Gesundheitsausschusses im Deutschen Bundestag,33071479,4572,274,14643,https://pbs.twimg.com/profile_images/1321743973015298049/xatgLuDB.jpg,cdu,0.35,0.2,3.3254184578351373,"Plattform, Schrappe, Sormas, Kommunen, Digital, Erwin, Software, Sormas, Corona, Schrappe, wirsindGKV, SPD, ",-0.002964285714285717,0.44999999999999996
152,@meister_schafft,Dr. Michael Meister,2009-04-22 07:21:25,,34214048,3550,956,11954,https://pbs.twimg.com/profile_images/895224245441187841/onDkIhAZ.jpg,cdu,0.8,0.0,16.622725113935587,"Corona, CDU, Scholz, Wirecard, cumex, Warburg, Wirtschaftshilfen, Superwahljahr, ltwbw21, ltwrlp21, PiDay, idm314, IDM, Element, Hessen, BILD, Reichelt, Compliance, Corona, CDU, BTW2021, Middelberg, Weltpolitik, Innenpolitik, ",0.03145833333333333,0.19999999999999996
153,@tj_tweets,Thomas Jarzombek,2009-05-02 01:39:20,doing rocket science for the federal Government,37105136,16073,828,9700,https://pbs.twimg.com/profile_images/378800000306809625/1cf5f05debe2515e84d39e9fd335d7c4.jpeg,cdu,0.35,0.35,1.5469409682231157,"Maskenaffäre, Infostand, Bundestagsabgeordneten, Pempelfort, Impfungen, Radwege, neue, Mitglieder, Startups, Gründer, Mönchengladbach, Rheydt, Drohnen, Lichtshow, Rhein, Düsseldorf, Silvesternacht, Sicherheit, Altstadt, BerichtausBerlin, Korruption, maskenskandal, eVTOLs, Flugtaxis, TKG, Transrapid, Hyperloop, Hyperloop, newspace, ",0.010208333333333337,0.30000000000000004
154,@ChristianHirte,Christian Hirte,2009-05-04 11:44:48,"Mitglied des Deutschen Bundestages, Landesvorsitzender der CDU Thüringen",37642893,6621,266,11220,https://pbs.twimg.com/profile_images/1352655752146673668/OCcrc8tN.jpg,cdu,0.65,0.05,3.999680940220334,"Spende, Plenumth, Desinformation, Fukushima, Parteichefin, plenumth, Corona, ThüringenJournal, Corona, Thüringen, Vertrauen, Transparenz, Dobrindt, EqualPayDay, GenderPayGap, Jena, Thueringen, Exzellenz, NRW, Wohnungseinbrüche, Reul, PKS, ",0.12648611111111113,0.29999999999999993
155,@rbrinkhaus,Ralph Brinkhaus,2009-05-05 19:45:20,"CDU-Bundestagsabgeordneter, Vorsitzender der CDU/CSU-Bundestagsfraktion. Es twittert hier vor allem sein Team.",38001527,23462,662,2239,https://pbs.twimg.com/profile_images/844831051499298823/rs5U5dMm.jpg,cdu,1.0,0.0,1.5065300484177442,"Nachhaltigkeit, Vertrauen, Transparenz, illner, Corona, Impfen, Masken, Schnelltest, maskenaffaere, MarkusLanz, MarkusLanz, BerichtausBerlin, Coronavirus, Faktencheck, Befristung, Corona, Infektionsschutzgesetz, Livestatement, Fraktionssitzung, Bundestag, Schiewerling, ",0.08845833333333333,0.0
156,@juergenhardt,Jürgen Hardt MdB,2009-05-07 16:53:05,"Mitglied des Deutschen Bundestages, Außenpolitischer Sprecher der CDU/CSU-Bundestagsfraktion - 🇩🇪 MP, Foreign Policy Spokesman CDU/CSU-Parliamentary Group",38467606,5862,652,4404,https://pbs.twimg.com/profile_images/1279029703182094337/3te2PtyM.jpg,cdu,0.15,0.15,1.0023539720851897,"COVID, Remscheid, fürdasbergischeinberlin, Gorbatschow, Maduro, EU, ResoluteSupport, Afghanistan, NATO, Bundeswehr, WirGegenExtremismus, WirDankenEuch, miltwitter, Nawalny, ",0.08646428571428572,0.7
157,@TSchipanski,Tankred Schipanski,2009-05-14 05:53:10,"CDU Bundestagsabgeordneter, Digitalpolitischer Sprecher der CDU/CSU Bundestagsfraktion",39938182,4630,181,26991,https://pbs.twimg.com/profile_images/1236787805256404992/B2c6a5Wx.jpg,cdu,0.75,0.05,5.165145369957374,"Ilmenau, Thueringen, Wochenende, Heimat, Eisenmann, Baldauf, BaWü, RLP, CDU, wirmachendas, ltwrlp, noAfD, dd1303, Dresden, Querdenker, Gewalt, Bild, BTW21, Polizisten, NRW, Dünzel, DD1303, Coronavirus, Exchange, DeutschlandDigitalSicherBSI, wirmachendas, Bund, Bremen, projektphoenix, DigitaleSouveraenitaet, Martinroda, Ilmkreis, ",0.07024999999999999,0.19999999999999996
158,@kaiwegner,Kai Wegner,2009-05-14 14:07:45,Landesvorsitzender der @cduberlin | Bundestagsabgeordneter der @CDU für #Spandau und #Charlottenburg-Nord | Baupolitischer Sprecher der @cducsubt,39999872,5528,821,4599,https://pbs.twimg.com/profile_images/1314278198889377794/S3zTK9_g.jpg,cdu,0.25,0.1,1.7757712264166212,"madeinberlin, USA, Mauerfall, Optimismus, Zuversicht, Berlin, Spitzenkandidat, Lohnlücke, equalpayday, genderpaygap, Rigaer94, Senat, r2g, Rigaer, ARD, R2G, Menschen, hartaberfair, Einfamilienhäuser, hartaberfair, Wohnungspolitik, R2G, Wohnungspolitik, Ziel, Weltfrauentag, Dankbarkeit, Einsatz, Chancengleichheit, Vergütung, bereitfürmehr, hartaberfair, Berlin, Sonntagslektüre, bereitfürmehr, Recht, Gesetz, Rigaer94, Brandschutz, Berlin, Mobilität, bereitfürmehr, r2g, Rigaer94, Berlinwahl, Berlin, bereitfürmehr, ",0.01824999999999999,0.65
159,@NadineSchoen,Nadine Schön,2009-05-22 16:06:06,"Bundestagsabgeordnete für den Wahlkreis 298 (Saarland), CDU",41840905,9995,1414,3484,https://pbs.twimg.com/profile_images/819151017765957633/73p4LbVu.jpg,cdu,0.4,0.2,0.6389673462536309,"angriffaufunserekinder, Mausgeburtstag, maus50, LustaufZukunft, Polarisierung, Stiftungen, Demokratie, Menschenrechte, Zuversicht, Gestaltungsfähigkeit, Menschen, UpdateDeutschland, wegenmorgen, neustaat, staat, cdu, JetztZukunft, JetztZukunft, JetztZukunft, SheTransformsIT, jetztzukunft, Datenlabor, Datenstrategie, clubhouse, imRegierungsviertel, Datenschutz, Coronahilfen, phoenixrunde, Pandemie, Datenstrategie, Gesundheitsdaten, Daten, ",0.20902777777777776,0.3999999999999999
160,@RKiesewetter,Roderich Kiesewetter🇪🇺🇩🇪🇺🇳,2009-05-26 19:29:44,Vorsitz #PKGr #Bundestag. Obmann #Aussenpolitik @cducsubt. Sprecher Beirat #BAKS. #MdB #CDU #Ostalb direktgewählt. Colonel(GS) ret. Views my own RT≠endorsement.,42698498,11235,7974,22512,https://pbs.twimg.com/profile_images/843119065719869440/SBYhbV5j.jpg,cdu,0.6,0.4,15.060166253543244,"esreicht, Berlin, Corona, b1303, SPD, Schwesig, Platzek, Schroeder, spd, cdu, maskenaffaere, Maskenskandal, dd1303, Dresden, Querdenker, Gewalt, Düsseldorf, Maskenaffäre, Umweltspuren, Impfungen, Neumitglieder, VolksparteiAlive, EU, PESCO, Wehrbeauftragte, Bundeswehr, Afghanistan, ",0.010833333333333334,0.0
161,@PatrickSensburg,Patrick Sensburg,2009-05-30 14:52:10,Mitglied des Deutschen Bundestages,43537931,2975,113,1279,https://pbs.twimg.com/profile_images/887359859636789248/PzVcVnEe.jpg,cdu,0.7,0.1,0.49809482148912887,"WirStellenEin, Reservistenverband, Willingen, Hochsauerlandkreis, loyal, NATO, loyalmagazin, WirSindDieReserve, ReserveRockt, FranzStock, Bundesrates, Juristenfakultätentags, 10K3, 11K3, Karfreitagsgefecht, Bundeswehr, Reservisten, Bundeswehr, Bundeswehr, Reservistenverband, Bundeswehr, Unterhaltssicherung, App, Reservistenverband, WirSindDieReserve, BSH, Fallschirmjäger, NH90, ReserveRockt, Bundeswehr, Titelthema, loyalmagazin, Bundeswehr, JIPSS, ACIPSS, US, COI, OSS, BIK, ",0.07083333333333332,0.20000000000000007
162,@FrankHeinrich,Frank Heinrich,2009-06-01 20:03:31,"geb. '64, Sozialpäd. + Theologe, '97 bis '09 Leiter Heilsarmee Chemnitz, seit '09 Bundestagsabgeordneter für Chemnitz, glücklich verheiratet, 4 Kinder, 4 Enkel",43959185,1931,4,1185,https://pbs.twimg.com/profile_images/1768649616/Frank_vor_Kuppel_web.jpg,cdu,0.0,0.0,0.027850967075386715,"BerlinerMauer, Mauertote, frankheinrich, braintreeacademyofficial, frankheinrichchemnitz, frankheinrichchemnitz, keinkindwilltöten, ",0.1819583333333333,1.0
163,@MarcHenrichmann,Marc Henrichmann,2009-06-04 12:56:07,"Leidenschaftlicher Münsterländer. Für den Wahlkreis Coesfeld-Steinfurt II im Deutschen Bundestag. Mit Faible für Innenpolitik und den offenen, fairen Dialog.",44608858,559,538,495,https://pbs.twimg.com/profile_images/1328347525456273409/rmh2aLiX.jpg,cdu,0.35,0.05,0.9359667787325239,"Wirtschaftshilfen, datenschutz, clankriminalität, Verdacht, Scholz, Wirtschaftshilfe, Bundesfinanzminister, wirecard, corona, generationengerechtigkeit, stabilitätspakt, zukunft, nachhaltigkeit, ausgabendisziplin, eu, cducsubt, vertrauen, berichterstatter, zukunft, registermodernisierungsgesetz, datenhoheit, Thierse, SPD, demokratie, dialog, Esken, vorwärtsgewandt, AFD, Extremismus, verfassungsschutz, demokratie, rechtsstaat, Optimisten, Impfstoff, corona, mut, SPD, optimismuswagen, pfeiffenimwalde, groko, politik, respekt, nummerkleiner, Regierungspartei, spd, Verantwortung, schwarzmaler, Föderalismus, SPD, kmk, esken, bildung, ",0.02077380952380952,0.6000000000000001
164,@UweFe,Uwe Feiler,2009-06-14 19:05:12,,47151012,184,0,1,https://pbs.twimg.com/profile_images/262798634/Uwe_Feiler.jpg,cdu,0.0,0.0,0.0002330915626419594,,-0.35,1.0
165,@DrAndreasNick,Dr. Andreas Nick 🇩🇪🇪🇺🇺🇳,2009-06-21 22:26:05,"MdB, Wahlkreis 204 Montabaur (Westerwald/Rhein-Lahn) @cducsubt - Head of German Delegation to Parliamentary Assembly CoE @PACE_News @coe - Dr. rer. pol., MIPP",49450039,6535,7993,25676,https://pbs.twimg.com/profile_images/867338230529740800/KaK3EmIT.jpg,cdu,0.7,0.2,6.827081980914905,"WirHandeln, Wirges, AlexandraMarzi, Hachenburg, janickpape, petermoskopp, matthiaslammert, udorau, cdurheinlahn, cdurlp, ltwrlp21, ltwrlp21, COVID19, Wahlkampföffnung, CMDH, release, humanrights, Kavala, Turkey, Israel, wirmachendas, Corona, ltwrp21, baldauf21, wirmachendas, ",0.2483333333333333,0.10000000000000009
166,@thomasgebhart,Thomas Gebhart MdB,2009-06-27 16:33:33,"🌄 Für eine starke Südpfalz. 
🗳 Bundestagsabgeordneter
💼Parlamentarischer Staatssekretär beim @bmg_bund",51483238,2829,594,1446,https://pbs.twimg.com/profile_images/1238064547958841344/ku9XxVq5.jpg,cdu,0.35,0.1,0.3011262535314307,"ltwrlp21, AstraZeneca, Corona, Pflegeheim, CoronaSchutzimpfung, Coronavirus, AHAFormel, Schutz, cdupt21, wegenmorgen, cdupt21, wegenmorgen, cdupt21, wegenmorgen, Corona, Pflegekraefte, Bundestag, Coronavirus, Impfung, Pandemiebekämpfung, Schutzimpfung, Impfungen, ",0.10208333333333333,0.55
167,@StefanKaufmann,Stefan Kaufmann,2009-06-28 15:14:58,🏛 MdB📍Stuttgart 🚀 Innovationsbeauftragter Grüner Wasserstoff @bmbf_bund 🇩🇪 @CDU 💡 Zukunft 🔬 Forschung 💪 Chancen,51752254,6441,3973,13605,https://pbs.twimg.com/profile_images/799571220194852866/8tgO-fb1.jpg,cdu,0.0,0.7,3.756693305321008,"Regenbogenflagge, LGBTIQFreedomZone, Energiewende, Klimaschutz, Atomkraft, Speicherung, Wasserstoff, GlobalGenderGapReport, Wissenschaft, Forschung, Deutschland, GenderCareGap, Chancengleichheit, Wasserstoff, Zukunft, GrünerWasserstoff, H2, Innovation, Weichs, Wasserstoff, BImSchG, ",0.19611111111111107,0.30000000000000004
168,@matthiaszimmer,matthias zimmer,2009-07-02 06:45:11,Ihr Frankfurter Abgeordneter im Deutschen Bundestag,52994606,1545,171,1417,https://pbs.twimg.com/profile_images/3542199073/933108732461d85b582b2e0770252885.jpeg,cdu,0.0,1.0,14.290537997153173,,0.1975,0.0
169,@CarstenMuellers,Carsten Müller,2009-07-05 16:35:50,"Bankkaufmann, Rechtsanwalt, Bundestagsabgeordneter",53945479,154,0,1,https://pbs.twimg.com/profile_images/303579791/Twitter_Portrait.jpg,cdu,0.0,1.0,0.0002343488021560457,,0.0,0.0
170,@PeterWeissMdB,Peter Weiß,2009-07-06 13:24:44,Direkt gewählter Bundestagsabgeordneter des Wahlkreises Emmendingen-Lahr und Vorsitzender der Arbeitnehmergruppe der CDU/CSU-Bundestagsfraktion,54202670,725,39,3,https://pbs.twimg.com/profile_images/556012778037583873/aagjlBh0.jpeg,cdu,0.0,0.0,0.001333118208455267,"Pflege, BenevitPflege, Rebenblüte, BerlinAktuell, Newsletter, Inklusion, ",0.11666666666666665,1.0
171,@ThomasHeilmann,Thomas Heilmann #NEUSTAAT,2009-07-14 20:30:19,"MdB für #SteglitzZehlendorf (#CDU), Justizsenator a.D., Digitalpolitiker, Internetunternehmer, Autor vom #NEUSTAAT Mein Team kommentiert mit /TTH",56806603,1900,711,541,https://pbs.twimg.com/profile_images/986961851169861633/fLiyCluK.jpg,cdu,0.35,0.1,0.5388184130363929,"Testen, NEUSTAAT, Datenwirtschaftsprüfer, Neustaat, Schön, Vermögensabschöpfung, Sicherheit, Sachsen, CoronaSN, Peking, Zentralbankgeldes, Renminbis, Europa, Lieferkettengesetz, Europa, Corona, Neustaat, wegenmorgen, Homeschooling, Schule, wegenmorgen, neustaat, staat, cdu, Neustaat, Neustaat, Wutausbruch, Bürokratie, büroktatie, Irrsinnderwoche, Staatsmodernisierung, verwaltung, SteglitzZehlendorf, Podcast, cdu, cducsu, daten, startup, vc, digitalisierung, neustaat, Datatalk, Datensparsamkeit, Datensouveränität, DataTalk, JetztZukunft, wegenmorgen, Datensouveränität, Datenstrategie, Neustaat, Marktwirtschaft, Demokratie, Europa, kalt, Berlin, DRK, Kältebus, berlinerstadtmission, ",0.17625000000000002,0.55
172,@olavgutting,Olav Gutting,2009-07-20 09:03:25,"Volksvertreter, Rechtsanwalt",58429842,3056,497,8957,https://pbs.twimg.com/profile_images/709827386179776516/MZd-6O0w.jpg,cdu,0.05,0.55,0.6772506465788908,"Kretschmann, LtwBW21, Waghäusel, Bundestag, Doppelbesteuerung, Rente, Gorbatschow, Kohl, Bundestag, Bargeld, Feld, Wirtschaftsweisen, Scholz, Corona, Berlin, R2G, Grünen, Coronahilfen, ",0.06866666666666667,0.3999999999999999
173,@KEESdeVriesCDU,KEES de Vries,2009-07-21 12:08:51,CDU-Direktkandidat im Wahlkreis Anhalt (72) für die Wahl zum Deutschen Bundestag,58777977,168,29,19,https://pbs.twimg.com/profile_images/324460460/_CDU.jpg,cdu,0.0,0.0,0.004467020218182151,,0.3592105263157894,1.0
174,@Manfredbehrens,"Manfred Behrens, CDU",2009-07-30 19:37:13,"Ortsbürgermeister, Kreistagsabgenordneter und  Bundestagskandidat",61577387,1012,7,236,https://pbs.twimg.com/profile_images/355079922/manfred-behrens.jpg,cdu,0.0,0.0,0.007255489777738958,,0.14250000000000002,1.0
175,@ninawarken,Nina Warken,2009-08-13 17:14:41,"MdB, Integrationsbeauftragte @cducsubt, Vorsitzende BFA Innere Sicherheit @cdu",65413134,1292,637,1765,https://pbs.twimg.com/profile_images/603659485782114305/tJphw_xs.jpg,cdu,0.55,0.2,0.3767807930781127,"Förderpreis, Bevölkerungsschutz, HelfendeHand, HelfendeHand21, Integration, Integrationsgipfel, ltwbw21, Impfdesaster, meineStimmegegenHass, Hanau, InstaLive, Kabinett, Integration, bundestag, mautua, Maut, WahrheitstattWahlkampf, Maut, WahrheitstattWahlkampf, MautUA, ",0.0004166666666666624,0.25
176,@fuchtel,Hans-Joachim Fuchtel,2009-08-18 18:04:36,Parlamentarischer Staatssekretär bei der Bundesministerin für Ernährung und Landwirtschaft / CDU-MdB für Calw und Freudenstadt,66750542,2267,124,1114,https://pbs.twimg.com/profile_images/378800000208004669/6b6ad21fd18281b039c6b1a7a5c18500.jpeg,cdu,0.65,0.0,0.021250472956060376,"Tierwohl, Agriculture, EEX, exchange, dairy, cdupt18, CDU, Wolf, Lebensmittel, Nachhaltig, Konsum, Lebensministerium, Kabinettsklausur, Digitalisierung, Ehrenamt, Landwirtschaft, Digitalisierung, zgfdt, Dürre, Trockenheit, Landwirtschaft, Staatssekretär, Röring, Wehnen, ",0.138125,0.35
177,@JoSteiniger,Johannes Steiniger,2009-10-18 23:38:01,"Direkt gewählter Bundestagsabgeordneter für den WK Neustadt-Speyer, @cducsubt, Finanzausschuss, Sportausschuss, Gymnasiallehrer für Mathematik und Politik",83474160,4098,1346,9379,https://pbs.twimg.com/profile_images/1266440269743951877/VbuK5PPx.jpg,cdu,0.5,0.4,4.940834996279844,"ltwrlp21, Wahlkampföffnung, B117, DritteWelle, Weltpolitik, Innenpolitik, CDU, swr, spitzenrunde, wirmachendas, Baldauf, EqualPayDay, GenderPayGap, ",0.01829166666666667,0.09999999999999998
178,@BjoernSimon,Björn Simon,2009-12-01 12:03:11,🇩🇪 CDU-Bundestagsabgeordneter 📍 Stadt- und Kreis Offenbach ✈️ Verkehrs- & 🌍 Umweltpolitiker,93845554,298,297,201,https://pbs.twimg.com/profile_images/1302591664658186241/UM4AgGtS.jpg,cdu,0.45,0.0,1.6012326191382764,"Kandidaten, Bundestagswahl, Wahlkampf, wegenmorgen, btw21, Erstimpfung, Fukushima, Transparenz, Dobrindt, Impfen, Impfungen, Impfkampagne, Landesregierung, Öffnungsschritt, Hessen, FWD, dmp21, Mobilitätspreis, Daten, Weltfrauentag, VereintenNationen, Gleichberechtigung, Gleichstellung, Bundeswehr, Corona, Amtshilfe, FürEuchGemeinsamStark, Nüßlein, Löbel, Bundeswehr, SeaGuardian, Bund, Länder, Lockerungen, Maßnahmen, Corona, Inzidenz, Einzelhandel, Pandemie, COVID, COVID19, Bund, Langen, Haushaltsausschuss, Bundestag, Bundesverkehrsminister, Plenum, Regierungsbefragung, Sitzungswoche, Parlament, Bundestag, Personenbeförderungsrecht, Mobilität, Uber, Taxi, MobilitätDerZukunft, DLRK2019, ",0.13791666666666666,0.55
179,@groehe,Hermann Gröhe,2009-12-03 16:38:02,Bundestagsabgeordneter aus dem Rhein-Kreis Neuss. Member of the German Parliament. Stellv. Vorsitzender der CDU/CSU-Bundestagsfraktion und der KAS.,94363834,49747,719,3321,https://pbs.twimg.com/profile_images/1361658113787584515/c1LpgksF.jpg,cdu,0.5,0.0,2.100255982158789,"tempusfugit, NRW, Wohnungseinbrüche, Reul, PKS, tempusfugit, BerichtausBerlin, tempusfugit, Mossul, PapstFranziskus, Neverforget, Irak, tvduell, wirmachen, baldauf21, epidemischeLage, Bundestag, Schlümpfe, Bildungslücke, ",0.11124999999999999,0.5
180,@GittaConnemann,Gitta Connemann,2010-01-10 20:30:04,Geboren in den 60ern im hohen Norden. Mitglied und Dabei.,103658778,314,3,1,https://pbs.twimg.com/profile_images/622934427/gc.jpg,cdu,0.0,0.0,0.0002450415509080439,,0.0,1.0
181,@TinoSorge,Tino Sorge,2010-02-01 10:50:53,Mitglied des Deutschen Bundestages @cducsubt | Direkt gewählter Abgeordneter des Wahlkreises Magdeburg | #CDU #SachsenAnhalt #Magdeburg #Berlin,110385973,2656,291,4226,https://pbs.twimg.com/profile_images/1202542927236534272/EMAc0cCH.jpg,cdu,0.05,0.25,1.0433200940781935,"DritteWelle, guteNachricht, moderndenken, SachsenAnhalt, CDUCSU, Frauen, Frauentag, Weltfrauentag, Ärzte, Impfpriorisierung, Woche, Wochenende, Bundestag, magdeburg, Corona, politik, freitag, sachsenanhalt, CDU, cducsubt, lockdown, impfung, Impfstoff, Impfpass, Linken, HennigWellsow, digitalen, impfpass, cducsu, corona, impfung, Impfstoffe, gegencorona, digital, gesundheit, cdu, bundestag, Impfstrategie, reisen, papierlos, magdeburg, Sachsenanhalt, debatte, plenum, Corona, Impfpass, Tagesordnung, Bundestages, cdu, impfen, Impfungen, Corona, Debatten, Impfstoff, Digital, Gesundheit, SachsenAnhalt, magdeburg, Impftermine, Arztpraxen, Schnelltests, Selbsttests, Impfen, Testen, MPK, Lockerungen, RareDiseaseDay, Familien, Patienten, Medizin, Forschung, Gesundheitswirtschaft, Wochenende, Themen, cducsu, Bundestag, plenum, magdeburg, Corona, sitzungswoche, sachsenanhalt, CDU, lockdown, stufenplan, impfstoff, Inzidenz, AstraZeneca, Impfstoff, Priorisierung, ",0.06680555555555555,0.7
182,@NikolasLoebel,,,,,,,,,cdu,,,,,,
183,@JensKoeppen,Jens Koeppen,2010-05-21 08:20:13,Nägel mit KOEPPEN - MdB - Wahlkreis 57 Uckermark und Barnim - Elektrotechniker - Unternehmer,146376562,3494,336,5139,https://pbs.twimg.com/profile_images/1360483066779729921/MZaajIlL.jpg,cdu,0.1,0.1,0.06676591586713658,"Lauterbach, genderwahn, windkraft, artenschutz, Windkraft, Wald, Stopp, nichtvondieserwelt, grüne, lockdown, lockdown, lockdown, Eberswalde, Arbeitsgericht, Barnim, Uckermark, lockdown, hoffnung, perspective, exitstrategie, Landesgruppe, CDUBrandenburg, fürbrandenburginberlin, Zukunftspaket, Aufbruch, CDUCSU, Akzeptanz, Windkraft, ",0.135,0.8
184,@HeikeBrehmerMdB,Heike Brehmer,2010-05-31 19:34:09,"Mitglied des Deutschen Bundestags für den Harz und das Salzland, CDU, Wk 68",150372237,1630,967,2180,https://pbs.twimg.com/profile_images/1004754650426433536/XjQuLlaN.jpg,cdu,1.0,0.0,0.9377383714975595,"WirHandeln, Ehrenerklärung, Aufklärung, Transparenz, Weltfrauentag, Bundestag, trauer, Bundestag, schönensonntag, Corona, Liquidität, wirhandeln, Verbraucher, SachsenAnhalt, Wochenstart, Bundestag, Sitzungswoche, Bundestag, SchönenSonntag, Bundestag, cducsu, ",0.04291666666666666,0.0
185,@MatthiasHeider,Matthias Heider,2010-06-10 08:05:03,"Rechtsanwalt, MdB, stellv. Vorsitzender im Wirtschaftsauschuss @Bundestag und der @MIT_Bund",154064825,1682,239,538,https://pbs.twimg.com/profile_images/1075737354109890561/qkgocDhJ.jpg,cdu,0.35,0.05,0.024052227181773623,"GWB, Hitzerekord, Nachhaltigkeit, Bundestag, SozialeMarktwirtschaft, Landarztstudium, Ärzten, Wahlkreis, Landarzt, Merz, Merz, USA, Bundestages, Merz, CDUpt18, Soli, cdupt18, Hamburg, aufbruch, erneuerung, Volkspartei, cdupt18, MitHerzblut, lpt18, ",0.2029166666666667,0.6000000000000001
186,@Axel_Fischer,Axel Fischer,2010-06-29 12:44:25,,160906608,824,208,827,https://pbs.twimg.com/profile_images/1035489090/fischer.jpg,cdu,0.3,0.0,0.08570506535032553,"cdu, landesparteitag, lptcdubw, CDU, Bundesparteitag, wegenmorgen, bpt21, frohe, festtage, weihnachten, CDU, Bundesparteitag, dihital, cdu, Chef, chefin, Mitglied, cdu, zukunft, politik, wirtschaft, arbeitsmarkt, arbeit, freiheit, demokratie, Georgien, Moria, Leipzig, SPD, Scholz, Steuererhöhungen, Coronakrise, Soli, wildtiere, schutz, umwelt, tiere, tierwohl, natur, landwirtschaft, bauer, jäger, grabenneudorf, landkreiskarlsruhe, Bund, deutschland, wald, cdu, union, landwirtschaft, CDU, Heimat, vertriebene, heimatvertriebene, europa, freiheit, menschenrechte, Sommergruß, Ferienzeit, Sommer, Sommerferien, Schulferien, waechterruf, gesichtzeigen, silidarität, Beschäftigen, badischenstaatstheaterkarlsruhe, ",0.16208333333333333,0.7
